"nav-link","listing-location","currency","price","bed","bath","listing-floorarea","listing-floorarea 2","hidden-sm href 2","hidden-sm 2"
"Dijual Rumah Prima Harapan Regency, Bekasi","Bekasi Utara, Bekasi, Jawa Barat","Rp","790 jt","2","1","38 m²","Rp 8.681.319 per m²","",""
"Dijual/disewakan rumah di Bulevar Hijau","Bulevar Hijau, Boulevard Hijau, Bekasi, Jawa Barat","Rp","3,2 M","5","5","300 m²","Rp 20.000.000 per m²","",""
"Pondok Ungu Permai","Pondok Ungu, Kaliabang, Bekasi, Jawa Barat","Rp","435 jt","2","1","50 m²","Rp 7.250.000 per m²","",""
"Yanagi Morizen Summarecon Bekasi","Jl. Morizen Summarecon Bekasi Bekasi Utara, Bekasi Utara, Bekasi, Jawa Barat","Rp","3,352 M","4","3","162 m²","Rp 24.467.153 per m²","",""
"Rumah siap huni 2lt  luas 15x23 347m2 Type 5KT Kemang Pratama Bekasi","Kemang Pratama Bekasi, Kemang Pratama, Bekasi, Jawa Barat","Rp","4,5 M","5","5","450 m²","Rp 12.968.300 per m²","",""
"Jati Raden Jati Sampurna Bekasi","Jaka Sampurna, Bekasi, Jawa Barat","Rp","850 jt","3","2","110 m²","Rp 7.083.333 per m²","",""
"Jual Rumah Pondok Gede Bekasi","Jl Celepuk, Jatimakmur, Pondokgede, Bekasi, Pondokgede, Bekasi, Jawa Barat","Rp","905 jt","3","2","95 m²","Rp 12.928.571 per m²","",""
"Kerens! Rumah di Kota Bekasi Pinggir Jalan Raya","Jl. Wibawa Mukti II, Jatiluhur, Kec. Jatiasih, Jatiasih, Bekasi, Jawa Barat","Rp","847 jt","3","1","63 m²","Rp 20.658.537 per m²","",""
"Rumah Hunian Exclusive dan Mewah dlm Cluster Kemang Pratama Regency","Kemang Pratama Regency Bekasi, Kemang Pratama, Bekasi, Jawa Barat","Rp","6,8 M","6","5","550 m²","Rp 14.166.667 per m²","",""
"griya setu pratama","jl. kubang, Setu, Bekasi, Jawa Barat","Rp","480 jt","2","1","36 m²","Rp 7.272.727 per m²","",""
"Rumah siap huni 2lt  luas 15x23 347m2 Type 5KT Kemang Pratama Bekasi","Kemang Pratama Bekasi, Kemang Pratama, Bekasi, Jawa Barat","Rp","4,5 M","5","5","450 m²","Rp 12.968.300 per m²","",""
"Dijual rumah siap huni di Harapan indah. Bekasi","Harapan indah. Bekasi, Harapan Indah, Bekasi, Jawa Barat","Rp","925 jt","3","2","90 m²","Rp 15.416.667 per m²","",""
"Dijual rumah siap huni di Harapan indah Bekasi","Harapan indah Bekasi, Harapan Indah, Bekasi, Jawa Barat","Rp","895 jt","3","3","90 m²","Rp 15.431.034 per m²","",""
"New Cluster Bintara Raya","Pondok kelapa, Bintara Jaya, Bekasi, Jawa Barat","Rp","800 jt","2","1","55 m²","Rp 12.307.692 per m²","",""
"Rumah Baru Klasik Modern di Angkasa Puri Jatiasih Bekasi","Jatiasih, Bekasi, Jawa Barat","Rp","1,6 M","4","3","131 m²","Rp 15.686.275 per m²","",""
"Rumah dijual Cluster Magnolia Summarecon Bekasi","Medan Satria, Bekasi, Jawa Barat","Rp","2,2 M","4","4","132 m²","Rp 17.460.317 per m²","",""
"Dijual Rumah Siap Huni Dekat Lippo Cikarang","Kampung sindang mulya, Cibarusah, Bekasi, Jawa Barat","Rp","168 jt","2","1","30 m²","Rp 2.800.000 per m²","",""
"Lippo Cikarang","Cluster Vassa Terrace, Cikarang Selatan, Bekasi, Jawa Barat","Rp","3,6 M","5","6","250 m²","Rp 18.000.000 per m²","",""
"Babelan","Jl.Pulo Timaha, Babelan, Bekasi, Jawa Barat","Rp","385 jt","2","2","36 m²","Rp 6.416.667 per m²","",""
"Rumah di grand galaxy City pekayon bekasi BARU minimalis cantik sangat STRATEGIS","grand galaxy City pekayon bekasi jawa barat, Galaxy, Bekasi, Jawa Barat","Rp","1,5 M","3","2","135 m²","Rp 20.833.333 per m²","",""
"Taman Kebalen Indah","Jl. Perjuangan, Babelan, Bekasi, Jawa Barat","Rp","489 jt","2","1","30 m²","Rp 8.150.000 per m²","",""
"Darmawangsa Residence Bekasi","Desa Satria Mekar, Tambun Utara, Bekasi, Jawa Barat","Rp","489 jt","2","1","40 m²","Rp 7.409.091 per m²","",""
"Dijual Rumah Murah Siap Huni Cikarang","Pilar sukatani, Karangbahagia, Bekasi, Jawa Barat","Rp","165 jt","2","1","30 m²","Rp 2.750.000 per m²","",""
"Green Sentosa Asri Cikarang",". Jl. Raya Pilar - Sukatani, Karang Sentosa, Karangbahagia, Bekasi, Jawa Barat","Rp","165 jt","2","1","30 m²","Rp 2.750.000 per m²","",""
"Dijual Rumah Murah Cikarang Dekat Mesjid Jamik","Cikarang, Cikarang, Bekasi, Jawa Barat","Rp","165 jt","2","1","30 m²","Rp 2.750.000 per m²","",""
"Rumah Murah Cikarang Dijual Cash 165 Juta","Jalan Sukakarya, Cikarang, Bekasi, Jawa Barat","Rp","165 jt","2","1","30 m²","Rp 2.750.000 per m²","",""
"Dukuh Zamrud","Jl. Mustika Jaya, Lambangsari, Bekasi, Tambun Selatan, Bekasi, Jawa Barat","Rp","465 jt","2","1","40 m²","Rp 7.750.000 per m²","",""
"Grand Residence","Jl. Raya Setu, Cijengkol, Setu, Setu, Bekasi, Jawa Barat","Rp","374 jt","2","1","40 m²","Rp 4.857.143 per m²","",""
"Dijual rumah di Kota Deltamas","Cluster Nice, Cikarang Pusat, Bekasi, Jawa Barat","Rp","1,2 M","3","2","100 m²","Rp 8.823.529 per m²","",""
"Kemang pratama 3 bekasi","Kemang Pratama, Bekasi, Jawa Barat","Rp","2,1 M","4","4","105 m²","Rp 15.555.556 per m²","",""
"Perumahan Wahana Pondok Gede","Bekasi, Bekasi, Jawa Barat","Rp","450 jt","2","1","36 m²","Rp 6.000.000 per m²","",""
"Rumah Kontrakan 3 Pintu Bagus STRATEGIS Di PERUMNAS BEKASI Dekat Mall Grand Metropolitan","Bekasi Selatan, Bekasi, Jawa Barat","Rp","810 jt","3","3","75 m²","Rp 9.000.000 per m²","",""
"Dijual Rumah Cluster Di Jatiasih, Mau Rumah Murah Hanya 600-an Juta Sangat Strategis Dekat Toll Jati","Jalan Swantantra, Jatiasih, Bekasi, Jawa Barat","Rp","679 jt","2","1","45 m²","Rp 10.777.778 per m²","",""
"perumahan Murah subsidi di cikarang","jl karang anyar, karang bahagia . cikarang, Cikarang, Bekasi, Jawa Barat","Rp","168,5 jt","2","1","30 m²","Rp 2.808.333 per m²","",""
"Rumah cluster  Grand wisata Murah Bebas Banjir di kota Bekasi grand wisata","Bisa Tanpa DP Proses KPR di Bantu, Mustikajaya, Bekasi, Jawa Barat","Rp","460 jt","2","1","40 m²","Rp 5.476.190 per m²","",""
"Rumah Cluster Minimalis Modern Jepang Terhebat di Bekasi","Setu, Bekasi, Jawa Barat","Rp","348 jt","2","1","40 m²","Rp 4.971.429 per m²","",""
"6 Bedrooms Rumah Kemang Pratama, Bekasi, Jawa Barat","Kemang Pratama, Bekasi, Jawa Barat","Rp","2,4 M","6","3","188 m²","Rp 8.921.933 per m²","",""
"Kemang Pratama 2","Jl Raya Pekayon, Pekayon, Bekasi, Pekayon Jaya, Bekasi, Jawa Barat","Rp","2,42 M","6","3","188 m²","Rp 8.996.283 per m²","",""
"Perumahan Gramapuri Persada","Jalan Raya Gramapuri - Cibitung, Cibitung, Bekasi, Jawa Barat","Rp","280 jt","2","1","60 m²","Rp 4.666.667 per m²","",""
"YUK HANYA 2 JT ALL IN BISA PUNYA RUMAH MEWAH, PELUANG INVESTASI TINGGI! !","jl.raya harapan indah bekasi, Cikarang Pusat, Bekasi, Jawa Barat","Rp","799 jt","3","1","63 m²","Rp 15.075.472 per m²","",""
"Dijual Rumah Siap Huni Apik Di Kemang Pratama Bekasi Lingkungan Tenang","Bekasi, Bekasi, Jawa Barat","Rp","1,3 M","3","1","90 m²","Rp 9.629.630 per m²","",""
"Legenda Wisata",". Jl. Raya Alternatif Cibubur, Cikeas Udik, Bekasi, Cibubur, Bekasi, Jawa Barat","Rp","1,85 M","4","4","300 m²","Rp 8.809.524 per m²","",""
"Cibubur residen","Cibubur residene, Bekasi, Bekasi, Jawa Barat","Rp","2,2 M","4","4","224 m²","Rp 12.222.222 per m²","",""
"Kemang Pratama",". Jl. Kemang Pratama Raya Elok, Bekasi, Bekasi, Jawa Barat","Rp","2,195 M","5","4","200 m²","Rp 9.380.342 per m²","",""
"rumah minimalis harga ekonomis di mutiara gading timur bekasi","mustikajaya, Bekasi Timur, Bekasi, Jawa Barat","Rp","575 jt","2","1","50 m²","Rp 7.986.111 per m²","",""
"Kemang Pratama",". Jl. Kemang Pratama Raya Elok, Bekasi, Bekasi, Jawa Barat","Rp","2,245 M","4","5","234 m²","Rp 13.858.025 per m²","",""
"Kemang Pratama",". Jl. Kemang Pratama Raya Elok, Bekasi, Bekasi, Jawa Barat","Rp","1,49 M","4","2","150 m²","Rp 9.197.531 per m²","",""
"Rumah Mungil Cocok Untuk Keluarga Kecil di Taman Sari Regency Setu Bekasi","Setu, Bekasi, Jawa Barat","Rp","850 jt","3","1","65 m²","Rp 7.083.333 per m²","",""
"Kota Harapan Indah Cluster Aralia","Jl. Bekasi Raya, Medan Satria, Bekasi, Medan Satria, Bekasi, Jawa Barat","Rp","1,25 M","3","2","100 m²","Rp 9.920.635 per m²","",""
"Legenda Wisata",". Jl. Raya Alternatif Cibubur, Cikeas Udik, Bekasi, Cibubur, Bekasi, Jawa Barat","Rp","2,3 M","5","4","250 m²","Rp 14.197.531 per m²","",""
"Kota Harapan Indah Cluster Aralia","Jl. Bekasi Raya, Medan Satria, Bekasi, Medan Satria, Bekasi, Jawa Barat","Rp","1,84 M","5","3","170 m²","Rp 9.246.231 per m²","",""
"Kota Harapan Indah Cluster Aralia","Jl. Bekasi Raya, Medan Satria, Bekasi, Medan Satria, Bekasi, Jawa Barat","Rp","1,345 M","4","2","100 m²","Rp 9.340.278 per m²","",""
"Harapan Indah",". Jl Bekasi Raya, Medan Satria, Bekasi, Medan Satria, Bekasi, Jawa Barat","Rp","585 jt","2","1","45 m²","Rp 9.750.000 per m²","",""
"VIRAL! ! 2 JT BISA PUNYA RUMAH DI THE JAKARTA RESIDENCE","jl.raya harapan indah bekasi, Harapan Indah, Bekasi, Jawa Barat","Rp","799 jt","3","2","63 m²","Rp 15.075.472 per m²","",""
"Legenda Wisata",". Jl. Raya Alternatif Cibubur, Cikeas Udik, Bekasi, Cibubur, Bekasi, Jawa Barat","Rp","1,7 M","5","4","250 m²","Rp 10.625.000 per m²","",""
"Kota Harapan Indah Cluster Taman Sari","Jl. Bekasi Raya, Medan Satria, Bekasi, Medan Satria, Bekasi, Jawa Barat","Rp","1,24 M","3","2","100 m²","Rp 9.841.270 per m²","",""
"Legenda Wisata",". Jl. Raya Alternatif Cibubur, Cikeas Udik, Bekasi, Cibubur, Bekasi, Jawa Barat","Rp","2,3 M","4","4","250 m²","Rp 10.952.381 per m²","",""
"Kota Harapan Indah Cluster Ifolia","Jl. Bekasi Raya, Medan Satria, Bekasi, Medan Satria, Bekasi, Jawa Barat","Rp","1,095 M","3","2","126 m²","Rp 8.690.476 per m²","",""
"Asera West, Harapan Indah, Bekasi","Clustr Asera west, Harapan indah, Tarumajaya, Bekasi, Jawa Barat","Rp","2,49 M","4","4","200 m²","Rp 15.562.500 per m²","",""
"Kota Harapan Indah Cluster Ifolia","Jl. Bekasi Raya, Medan Satria, Bekasi, Medan Satria, Bekasi, Jawa Barat","Rp","990 jt","3","2","45 m²","Rp 7.857.143 per m²","",""
"Jati sampurna","Jl alternatif cibubur, Bekasi Selatan, Bekasi, Jawa Barat","Rp","35 M","9","9","1200 m²","Rp 10.165.553 per m²","",""
"Legenda Wisata",". Jl. Raya Alternatif Cibubur, Cikeas Udik, Bekasi, Cibubur, Bekasi, Jawa Barat","Rp","2 M","3","2","88 m²","Rp 7.168.459 per m²","",""
"Turun Harga! Dijual rumah lebar 8 di cluster Asera Harapan Indah 2, Bekasi","Harapan Indah Cluster Asera, Tarumajaya, Bekasi, Jawa Barat","Rp","2,099 M","4","4","157 m²","Rp 14.576.389 per m²","",""
"Dijual Rumah Bagus Siap Huni di Cluster Adara Harapan Indah 2 Bekasi","Cluster Adara Harapan Indah 2 Bekasi, Harapan Indah, Bekasi, Jawa Barat","Rp","1,5 M","3","3","69 m²","Rp 13.888.889 per m²","",""
"Rumah dijual cluster ifolia harapan indah","Ifolia, Harapan Indah, Bekasi, Jawa Barat","Rp","1,25 M","2","2","85 m²","Rp 8.680.556 per m²","",""
"Legenda Wisata",". Jl. Raya Alternatif Cibubur, Cikeas Udik, Bekasi, Cibubur, Bekasi, Jawa Barat","Rp","4,5 M","5","4","400 m²","Rp 12.000.000 per m²","",""
"Citra grand","Citra gran cibubur, Bekasi Barat, Bekasi, Jawa Barat","Rp","3,25 M","6","4","300 m²","Rp 14.130.435 per m²","",""
"Duta Bumi 2","Perum Harapan Indah, Jl. Raya Harapan indah, Bekas, Bekasi, Bekasi, Jawa Barat","Rp","1,3 M","4","3","120 m²","Rp 11.607.143 per m²","",""
"Dijual rumah baru full renov, luas 94 di Harapan Indah 1, Bekasi","Harapan Indah 1, Bekasi, Harapan Indah, Bekasi, Jawa Barat","Rp","845 jt","3","2","60 m²","Rp 8.989.362 per m²","",""
"Dijual rumah baru full renov, lebar jalanan 6m di Harapan Indah 1","di Harapan Indah 1, Harapan Indah, Bekasi, Jawa Barat","Rp","860 jt","3","1","50 m²","Rp 10.617.284 per m²","",""
"Kota Harapan Indah Cluster Aralia","Jl. Bekasi Raya, Medan Satria, Bekasi, Medan Satria, Bekasi, Jawa Barat","Rp","1,28 M","4","3","112 m²","Rp 8.888.889 per m²","",""
"Cluster natura vida bekasi timur","Bantargebang, Bekasi, Jawa Barat","Rp","1,1 M","3","3","90 m²","Rp 13.095.238 per m²","",""
"Dijual Rumah  Siap Huni di Kemang Pratama Bekasi","di Kemang Pratama Bekasi, Kemang Pratama, Bekasi, Jawa Barat","Rp","1,345 M","3","2","135 m²","Rp 9.962.963 per m²","",""
"Dijual Rumah siap huni di Kemang Pratama 1 Bekasi","kemang pratama 1 bekasi, Kemang Pratama, Bekasi, Jawa Barat","Rp","1,49 M","4","3","180 m²","Rp 9.197.531 per m²","",""
"Dijual Rumah Hadap Taman di Cluster Tropical Garden Galaxy, Bekasi","Cluster Tropical Garden Galaxy, Bekasi, Galaxy, Bekasi, Jawa Barat","Rp","2 M","3","3","108 m²","Rp 22.222.222 per m²","",""
"Dijual Rumah 2 lantai di cluster Botanical Garden, Grand Galaxy City, bekasi","cluster Botanical Garden Grand Galaxy City, bekasi, Galaxy, Bekasi, Jawa Barat","Rp","1,6 M","3","3","108 m²","Rp 17.777.778 per m²","",""
"Dijual Rumah Cantik 2 lantai di Villa Galaxy, Galaxy, Bekasi","Villa Galaxy, Galaxy, Bekasi, Galaxy, Bekasi, Jawa Barat","Rp","1,85 M","4","3","200 m²","Rp 14.682.540 per m²","",""
"Kota Harapan Indah Cluster Aralia","Jl. Bekasi Raya, Medan Satria, Bekasi, Medan Satria, Bekasi, Jawa Barat","Rp","1,145 M","3","1","112 m²","Rp 10.223.214 per m²","",""
"Kota Harapan Indah Cluster Ifolia","Jl. Bekasi Raya, Medan Satria, Bekasi, Medan Satria, Bekasi, Jawa Barat","Rp","890 jt","3","2","54 m²","Rp 9.888.889 per m²","",""
"Kota Serang Baru","Cibarusah, Bekasi, Jawa Barat","Rp","310,000009 jt","2","1","60 m²","Rp 5.166.667 per m²","",""
"Kota Serang Baru","Bekasi Timur, Bekasi, Jawa Barat","Rp","310,000009 jt","2","1","60 m²","Rp 5.166.667 per m²","",""
"Bekasi Timur","Bekasi Timur, Bekasi, Jawa Barat","Rp","399,000009 jt","2","1","55 m²","Rp 5.320.000 per m²","",""
"Bekasi Timur","Bekasi Timur, Bekasi, Jawa Barat","Rp","399,000009 jt","2","1","55 m²","Rp 5.320.000 per m²","",""
"Bumyagara Graha Harapan","Bekasi Timur, Bekasi, Jawa Barat","Rp","735,000009 jt","3","2","95 m²","Rp 5.742.188 per m²","",""
"Grand Residence City","Bekasi Timur, Bekasi, Jawa Barat","Rp","435,000009 jt","2","1","45 m²","Rp 7.250.000 per m²","",""
"DiJual cepat Rumah Baru 2 Lantai di Harapan Indah 1, Bekasi.","Harapan Indah 1, Bekasi., Harapan Indah, Bekasi, Jawa Barat","Rp","985 jt","3","2","120 m²","Rp 10.478.723 per m²","",""
"Bekasi Timur Regency","Bekasi Timur, Bekasi, Jawa Barat","Rp","650,000009 jt","3","1","55 m²","Rp 7.647.059 per m²","",""
"Bekasi Timur Regency","Bekasi Timur, Bekasi, Jawa Barat","Rp","395,000009 jt","2","1","45 m²","Rp 6.583.333 per m²","",""
"Dijual rumah cantik cluster Bintara belakang Grand Kota Bintang, Bekasi","Bintara belakang Grand Kota Bintang, Bekasi, Bintara, Bekasi, Jawa Barat","Rp","895 jt","3","3","148 m²","Rp 10.654.762 per m²","",""
"Bekasi Timur Regency","Bekasi Timur, Bekasi, Jawa Barat","Rp","310,000009 jt","2","1","60 m²","Rp 5.166.667 per m²","",""
"Graha Harapan Bumyagara","Bekasi Timur, Bekasi, Jawa Barat","Rp","735,000009 jt","3","2","95 m²","Rp 5.742.188 per m²","",""
"Grand Residence","Bekasi Timur, Bekasi, Jawa Barat","Rp","435,000009 jt","2","1","45 m²","Rp 7.250.000 per m²","",""
"Grand Residence City","Bekasi Timur, Bekasi, Jawa Barat","Rp","435,000009 jt","2","2","45 m²","Rp 7.250.000 per m²","",""
"Graha Harapan Bumyagara","Bekasi Timur, Bekasi, Jawa Barat","Rp","735,000009 jt","3","2","95 m²","Rp 5.742.188 per m²","",""
"Telaga Harapan","Bekasi Timur, Bekasi, Jawa Barat","Rp","925,000009 jt","3","1","90 m²","Rp 7.773.109 per m²","",""
"Jual Rumah Bekasi Timur Regency/Regensi","Bekasi Jaya, Bekasi, Jawa Barat","Rp","650,000009 jt","3","1","60 m²","Rp 7.647.059 per m²","",""
"Jual Cepat Rumah Luas 108 Hook di Bekasi Timur Regency","Bekasi, Bekasi, Jawa Barat","Rp","450,000009 jt","2","1","60 m²","Rp 4.166.667 per m²","",""
"Jual Rumah Bekasi di Perumahan Graha Harapan Bumyagara","Bekasi Timur, Bekasi, Jawa Barat","Rp","810,000009 jt","3","2","95 m²","Rp 6.328.125 per m²","",""
"Hunian Rumah Dijual Cash/KPR di Bekasi Timur Regensi/Regency","Bekasi Timur, Bekasi, Jawa Barat","Rp","395,000009 jt","2","1","45 m²","Rp 6.583.333 per m²","",""
"Graha Harapan Bumyagara","Bekasi Timur, Bekasi, Jawa Barat","Rp","745,000009 jt","3","2","95 m²","Rp 5.820.313 per m²","",""
"Jual Rumah di Kota Serang Baru Cibarusah","Kota Serang Baru, Cikarang - Cibarusah, Cibarusah, Bekasi, Jawa Barat","Rp","335 jt","2","1","60 m²","Rp 5.583.333 per m²","",""
"Grand Residence","Bekasi Jaya, Bekasi, Jawa Barat","Rp","450,000009 jt","2","1","45 m²","Rp 7.500.000 per m²","",""
"Rumah Luas 60 di Bekasi Timur Regency Harga 300 Jutaan","Bekasi Selatan, Bekasi, Jawa Barat","Rp","450,000009 jt","2","1","45 m²","Rp 6.923.077 per m²","",""
"Jual Rumah Bekasi","Bekasi Selatan, Bekasi, Jawa Barat","Rp","810,000009 jt","3","2","95 m²","Rp 6.328.125 per m²","",""
"Jual Rumah Secondary Murah Bebas Banjir Bekasi Timur di Bekasi Timur Regensi Regency BTR","Bekasi Timur, Bekasi, Jawa Barat","Rp","495,000009 jt","2","1","60 m²","Rp 4.583.333 per m²","",""
"Bekasi Timur Regensi","Bekasi Timur, Bekasi, Jawa Barat","Rp","310,000009 jt","2","1","50 m²","Rp 4.305.556 per m²","",""
"Telaga harapan","Cibitung, Bekasi, Jawa Barat","Rp","925,000009 jt","3","1","90 m²","Rp 7.773.109 per m²","",""
"Jual Rumah Grand Residence","Bekasi Timur, Bekasi, Jawa Barat","Rp","450,000009 jt","2","1","45 m²","Rp 7.500.000 per m²","",""
"Jual Rumah Dekat Jakarta di Mutiara Gading Timur","Bekasi Jaya, Bekasi, Jawa Barat","Rp","650,000009 jt","2","1","55 m²","Rp 7.647.059 per m²","",""
"DiJual Rumah Fully Furnished, posisi hook di Taman Harapan Baru Bekasi","Taman Harapan Baru Bekasi, Bekasi, Bekasi, Jawa Barat","Rp","2,5 M","4","2","277 m²","Rp 8.710.801 per m²","",""
"Di Jual Rumah Super Bagus, Tanah Besar, Luas dalamnya, Murah di Cluster MGC, Mutiara Gading City Bekasi","BABELAN, Babelan, Bekasi, Jawa Barat","Rp","900 jt","3","1","60 m²","Rp 7.500.000 per m²","",""
"Di Jual Rumah Depan Taman, Nego sampai Jadi, Murah, di Cluster Ifolia, Harapan indah2","HARAPAN INDAH, Harapan Indah, Bekasi, Jawa Barat","Rp","1,9 M","4","3","259 m²","Rp 6.785.714 per m²","",""
"CitraGrand Cibubur CBD - New Project","Jl. CitraGrand Cibubur CBD, Jatisampurna, Bekasi, Jawa Barat","Rp","1,5 M","3","2","63 m²","Rp 25.000.000 per m²","",""
"Di jual Rumah Bagus, Besar, Luas, Siap Huni, 1. 5Lt, Jarang Ada, di Cluster Ifolia, Harapan indah2","HARAPAN INDAH, Harapan Indah, Bekasi, Jawa Barat","Rp","1,4 M","4","3","120 m²","Rp 9.722.222 per m²","",""
"Di jual Rumah Siap Huni, Semi Furnish, Bagus, di Cluster Vasana, Harapan indah2 Bekasi","HARAPAN INDAH, Harapan Indah, Bekasi, Jawa Barat","Rp","1,4 M","2","2","74 m²","Rp 12.962.963 per m²","",""
"Cibubur Residence","Jl Raya Alternatif Cibubur, Harjamukti, Bekasi, Cibubur, Bekasi, Jawa Barat","Rp","1,15 M","2","1","70 m²","Rp 12.777.778 per m²","",""
"Dijual Rumah Cakep, Bagus, full Renovasi, Siap Pakai, diTaman Sari - Harapan indah 2 Bekasi","HARAPAN INDAH, Harapan Indah, Bekasi, Jawa Barat","Rp","1,6 M","5","3","130 m²","Rp 12.698.413 per m²","",""
"Dijual Rumah Bagus, Jarang Ada, Tanah Besar, Siap Huni di  Cluster ifolia, Harapan Indah2","Harapan Indah2, Harapan Indah, Bekasi, Jawa Barat","Rp","1,75 M","4","3","144 m²","Rp 9.722.222 per m²","",""
"Di Jual Rumah Murah Sekali, Siap Huni, posisi depan, Strategis, di Harapan indah2  Bekasi","HARAPAN INDAH, Harapan Indah, Bekasi, Jawa Barat","Rp","1,25 M","3","3","150 m²","Rp 13.888.889 per m²","",""
"Cluster taman sari harapan indah","Harapan Indah, Bekasi, Jawa Barat","Rp","1,1 M","3","2","263 m²","Rp 8.730.159 per m²","",""
"Launching Cendana Spark Lippo Cikarang","Jalan boulevard Orange County, Cikarang Selatan, Bekasi, Jawa Barat","Rp","715 jt","2","2","55 m²","Rp 11.916.667 per m²","",""
"Jual cepat Rumah Baru Strategis Bebas Banjir Murah Bebas Pajak pinggir jalan raya di Setu Bekasi","Jl Setu, Setu Serang, Setu Bekasi, Setu, Bekasi, Jawa Barat","Rp","490 jt","2","1","42 m²","Rp 6.805.556 per m²","",""
"Rumah Pondok Gede Bekasi","Pondokgede, Bekasi, Jawa Barat","Rp","1,7 M","4","3","125 m²","Rp 13.600.000 per m²","",""
"Dijual Rumah Prima Harapan Regency,  Bekasi","Bekasi Utara, Bekasi, Jawa Barat","Rp","790 jt","2","1","38 m²","Rp 8.681.319 per m²","",""
"Grand Wisata Cluster Garden Terrace","Jl Bima Utama Raya, Lambang Sari, Bekasi, Tambun Selatan, Bekasi, Jawa Barat","Rp","1,6 M","3","2","105 m²","Rp 8.247.423 per m²","",""
"Bekasi timur regensi btr cimuning mustika jaya   17158","Bekasi timur regensi btr cimuning mustika jaya, Bekasi Timur, Bekasi, Jawa Barat","Rp","635,000003 jt","2","1","55 m²","Rp 8.819.444 per m²","",""
"Cibitung, cikarang barat - Kab. Bekasi 17520","Cibitung, cikarang barat - Kab. Bekasi, Cikarang Barat, Bekasi, Jawa Barat","Rp","850,000003 jt","3","1","90 m²","Rp 7.142.857 per m²","",""
"Bumyagara, Graha harapan, mustika jaya, bekasi timur 17158","Bumyagara Graha harapan, mustika jaya bekasi timur, Bekasi Timur, Bekasi, Jawa Barat","Rp","800,000003 jt","3","1","70 m²","Rp 8.163.265 per m²","",""
"Cibitung, cikarang barat - Kab. Bekasi 17520","Cibitung, cikarang barat - Kab. Bekasi, Cikarang Barat, Bekasi, Jawa Barat","Rp","925,000003 jt","3","1","90 m²","Rp 7.773.109 per m²","",""
"Cimuning, Mustika Jaya, Bekasi Timur 17156","Cimuning, Mustika Jaya, Bekasi Timur, Setu, Bekasi, Jawa Barat","Rp","399,000003 jt","2","1","55 m²","Rp 5.320.000 per m²","",""
"Cimuning, Mustika Jaya, Bekasi Timur 17156","Cimuning, Mustika Jaya, Bekasi Timur, Setu, Bekasi, Jawa Barat","Rp","399,000003 jt","2","1","55 m²","Rp 5.320.000 per m²","",""
"Bekasi timur regensi btr cimuning mustika jaya   17158","Bekasi timur regensi btr cimuning mustika jaya, Bekasi Timur, Bekasi, Jawa Barat","Rp","650,000003 jt","3","1","55 m²","Rp 7.647.059 per m²","",""
"Bekasi Timur Regency","Bekasi Timur, Bekasi, Jawa Barat","Rp","635,000009 jt","2","1","55 m²","Rp 8.819.445 per m²","",""
"Perum. Kota serang baru, cikarang selatan 17330","Perum. Kota serang baru, cikarang selatan, Cikarang Selatan, Bekasi, Jawa Barat","Rp","310,000003 jt","2","1","45 m²","Rp 5.166.667 per m²","",""
"Perum. Kota serang baru, cikarang selatan 17330","Perum. Kota serang baru, cikarang selatan, Bekasi Timur, Bekasi, Jawa Barat","Rp","310,000003 jt","2","1","45 m²","Rp 5.166.667 per m²","",""
"Grand Residence, Cijengkol, Setu 17320","Grand Residence, Cijengkol, Setu, Bekasi Timur, Bekasi, Jawa Barat","Rp","435,000003 jt","2","1","45 m²","Rp 7.250.000 per m²","",""
"Bekasi timur regensi btr cimuning mustika jaya   17158","Bekasi timur regensi btr cimuning mustika jaya, Bekasi Timur, Bekasi, Jawa Barat","Rp","635,000003 jt","2","1","55 m²","Rp 8.819.444 per m²","",""
"Cibitung, cikarang barat - Kab. Bekasi 17520","Cibitung, cikarang barat - Kab. Bekasi, Cibitung, Bekasi, Jawa Barat","Rp","925,000003 jt","3","1","90 m²","Rp 7.773.109 per m²","",""
"Bekasi timur regensi btr cimuning mustika jaya   17158","Bekasi timur regensi btr cimuning mustika jaya, Bekasi, Bekasi, Jawa Barat","Rp","395,000003 jt","2","1","45 m²","Rp 6.583.333 per m²","",""
"Bekasi timur regensi btr cimuning mustika jaya   17158","Bekasi timur regensi btr cimuning mustika jaya, Bekasi, Bekasi, Jawa Barat","Rp","635,000003 jt","2","1","55 m²","Rp 8.819.444 per m²","",""
"Bekasi timur regensi btr cimuning mustika jaya   17158","Bekasi timur regensi btr cimuning mustika jaya, Bekasi, Bekasi, Jawa Barat","Rp","635,000003 jt","2","1","55 m²","Rp 8.819.444 per m²","",""
"Bekasi timur regensi btr cimuning mustika jaya   17158","Bekasi timur regensi btr cimuning mustika jaya, Bekasi, Bekasi, Jawa Barat","Rp","875,000003 jt","3","1","75 m²","Rp 9.722.222 per m²","",""
"Bekasi timur regensi btr cimuning mustika jaya   17158","Bekasi timur regensi btr cimuning mustika jaya, Bekasi, Bekasi, Jawa Barat","Rp","875,000003 jt","3","1","75 m²","Rp 9.722.222 per m²","",""
"Cimuning, Mustika Jaya, Bekasi Timur 17156","Cimuning, Mustika Jaya, Bekasi Timur, Setu, Bekasi, Jawa Barat","Rp","399,000003 jt","2","1","55 m²","Rp 5.320.000 per m²","",""
"Bekasi timur regensi btr cimuning mustika jaya   17158","Bekasi timur regensi btr cimuning mustika jaya, Bekasi Timur, Bekasi, Jawa Barat","Rp","650,000003 jt","3","1","55 m²","Rp 7.647.059 per m²","",""
"Bekasi timur regensi btr cimuning mustika jaya   17158","Bekasi timur regensi btr cimuning mustika jaya, Bekasi Timur, Bekasi, Jawa Barat","Rp","800,000003 jt","3","1","70 m²","Rp 8.333.333 per m²","",""
"Cibitung, cikarang barat - Kab. Bekasi 17520","Cibitung, cikarang barat - Kab. Bekasi, Cikarang Barat, Bekasi, Jawa Barat","Rp","850,000003 jt","3","1","90 m²","Rp 7.142.857 per m²","",""
"Dijual Rumah Cluster Vernonia di Summarecon Bekasi","cluster vernonia, Bekasi Barat, Bekasi, Jawa Barat","Rp","7,5 M","5","4","185 m²","Rp 23.148.148 per m²","",""
"Cluster asera one south harapan indah","Harapan Indah, Bekasi, Jawa Barat","Rp","3,4 M","5","4","175 m²","Rp 15.740.741 per m²","",""
"Perumahan Vila Kencana","Jalan Raya Sukatani Cikarang, Cikarang Utara, Bekasi, Jawa Barat","Rp","85 jt","2","1","60 m²","Rp 2.833.333 per m²","",""
"Bekasi Timur Regency","Bekasi Timur, Bekasi, Jawa Barat","Rp","395,000009 jt","2","1","45 m²","Rp 6.583.333 per m²","",""
"Legenda Wisata",". Jl. Raya Alternatif Cibubur, Cikeas Udik, Bekasi, Cibubur, Bekasi, Jawa Barat","Rp","625 jt","2","1","46 m²","Rp 8.680.556 per m²","",""
"Cluster burgundy summarecon bekasi","Summarecon Bekasi, Bekasi, Jawa Barat","Rp","2,7 M","5","4","115 m²","Rp 14.516.129 per m²","",""
"CitraGran",". Jl Raya Alternatif Cibubur, Cikeas Udik, Bekasi, Cibubur, Bekasi, Jawa Barat","Rp","1,5 M","2","1","70 m²","Rp 11.111.111 per m²","",""
