"nav-link","listing-location","currency","price","bed","bath","listing-floorarea","listing-floorarea 2","hidden-sm href 2","hidden-sm 2"
"Cluster Lavesh Kota Harapan Indah","Harapan Indah, Bekasi, Jawa Barat","Rp","1,2 M","2","2","56 m²","Rp 14.285.714 per m²","tel:+628121173111","Hubungi"
"Palem Lestari","Jl. Raya Mess Al, Jatisampurna, Bekasi, Jawa Barat","Rp","1,187 M","3","3","77 m²","","",""
"Dijual rumah cluster Lavesh Harapan indah Bekasi","Harapan Indah, Bekasi, Jawa Barat","Rp","1,2 M","2","2","56 m²","Rp 14.285.714 per m²","tel:+6289505971571","Hubungi"
"CitraGrand Cibubur CBD - New Project","Jl. CitraGrand Cibubur CBD, Jatisampurna, Bekasi, Jawa Barat","Rp","1,21 M","3","2","60 m²","","",""
"Perumahan Terjangkau Lokasi Strategis Dekat ke Summarecon Crown Bekasi","jalan pertamina, Summarecon Bekasi, Bekasi, Jawa Barat","Rp","380 jt","2","1","36 m²","Rp 6.333.333 per m²","tel:+6287889698948","Hubungi"
"Rumah Minimalis DP0% Atap Tinggi, Sirkulasi Bagus 10 menit ke Harapan Indah Bekasi","Kedungjaya, Harapan Indah, Bekasi, Jawa Barat","Rp","355 jt","2","1","36 m²","Rp 5.916.667 per m²","tel:+6287889698948","Hubungi"
"Rumah Baru Siap Huni Modern Minimalis Murah Di Kodau Jatimekar","Kodau, Pondokgede, Bekasi, Jawa Barat","Rp","1,155 M","3","2","98 m²","Rp 11.213.592 per m²","tel:+6281282940124","Hubungi"
"Rumah Baru Dlm Cluster Design Klasik Dekat Toll Jatiwaringin","Jatiwaringin, Jati Waringin, Bekasi, Jawa Barat","Rp","1,7 M","4","3","125 m²","Rp 13.600.000 per m²","tel:+6281282940124","Hubungi"
"Rumah Baru 2Lt Siap Huni Dlm Cluster Di Jatimakmur","Jatimakmur, Jati Makmur, Bekasi, Jawa Barat","Rp","795 jt","3","2","72 m²","Rp 13.032.787 per m²","tel:+6281282940124","Hubungi"
"Di jual Cepat Rumah Siap Huni di  Perum Bintara Alam  Permai (BAP) Bekasi Barat","Bekasi Barat, Bekasi, Jawa Barat","Rp","1,9 M","4","3","230 m²","Rp 15.833.333 per m²","tel:+6281310097917","Hubungi"
"Rumah 2 lantai","Camar VI, Pondokgede, Bekasi, Jawa Barat","Rp","1,55 M","6","4","275 m²","Rp 7.750.000 per m²","tel:+62818968882","Hubungi"
"Rumah Baru Mustikajaya dekat ke Grand Wisata Bekasi Kota","Jl. jalan Mustikajaya, Bekasi Timur, Bekasi, Jawa Barat","Rp","565 jt","3","2","62 m²","Rp 5.539.216 per m²","tel:+6281213781161","Hubungi"
"Citaville Pilar Cikarang","Jl. Ki Hajar Dewantara, Cikarang, Bekasi, Jawa Barat","Rp","429,4 jt - Rp 526,8 jt","2","1","38 m²","","",""
"Rumah Siap Huni dekat Grand Wisata Bekasi","bekasi timur regency, Bekasi, Bekasi, Jawa Barat","Rp","415 jt","2","1","45 m²","Rp 6.916.667 per m²","tel:+6282119939868","Hubungi"
"rumah minimalis modern bekasi harga 300jt an","Bekasi Utara, Bekasi, Jawa Barat","Rp","1 jt","2","1","36 m²","Rp 16.667 per m²","tel:+6289634572787","Hubungi"
"Mansion Hill Jejalen","Jl. Kp. Jejalen No. 34, Tambun Utara, Bekasi, Jawa Barat","Rp","405 jt","2","1","40 m²","Rp 5.400.000 per m²","tel:+6289634572787","Hubungi"
"Mansion Hill Jejalen","Jl. Kp. Jejalen No. 34, Tambun Utara, Bekasi, Jawa Barat","Rp","405 jt","2","1","40 m²","Rp 5.400.000 per m²","tel:+6289634572787","Hubungi"
"Mansion Hill Sukamekar","Sukamekar, Kec. Sukawangi, Babelan, Bekasi, Jawa Barat","Rp","394,445 jt","2","1","45 m²","Rp 5.634.929 per m²","tel:+6289634572787","Hubungi"
"Bumi  Dirgantara Permai",". Jl. Jatiluhur-Jatiasih, Jati Sari, Bekasi, Jawa Barat","Rp","700 jt","2","1","70 m²","Rp 5.833.333 per m²","tel:+6281319454022","Hubungi"
"Perumahan Grand Permata Residence Sriamur Tambun Utara","Jln kong Isah Kp turi Sriamur, Tambun Utara, Bekasi, Jawa Barat","Rp","168 jt","2","1","29 m²","Rp 2.800.000 per m²","tel:+6287874339575","Hubungi"
"New Cluster, Mulberry Residence Summarecon Bekasi","The Orchard, Jl Perjuangan Bekasi Utara, Summarecon Bekasi, Bekasi, Jawa Barat","Rp","1,87812 M","4","4","93 m²","Rp 20.638.681 per m²","tel:+6281317449989","Hubungi"
"Rumah di Hoek Bumi Anggrek, Karang Satria, Tambun Utara, Bekasi","Bumi Anggrek Blok PQ Karang Satria, Tambun Utara, Tambun Utara, Bekasi, Jawa Barat","Rp","900 jt","3","1","120 m²","Rp 3.829.787 per m²","tel:+6281317449989","Hubungi"
"Rumah  dengan Halaman Luas di Bumi Arya Sena, Jati kramat, Jatiasih, Bekasi","Bumi Arya Sena, Jati kramat, Jatiasih, Bekasi, Jatiasih, Bekasi, Jawa Barat","Rp","8 M","6","4","300 m²","Rp 6.672.227 per m²","tel:+6281317449989","Hubungi"
"Rumah tua dekat Summarecon Bekasi , di Jalur Utama Bekasi Utara","Jl. KH Mucthar Tabrani Perwira , Bekasi Utara, Bekasi Utara, Bekasi, Jawa Barat","Rp","1,085 jt","2","1","45 m²","Rp 7.750 per m²","tel:+6281317449989","Hubungi"
"Summarecon Crown Gading","Summarecon Crown Gading, Harapan Indah, Bekasi, Jawa Barat","Rp","4 M","4","4","249 m²","Rp 20.833.333 per m²","tel:+6289697837233","Hubungi"
"Diskon DP 20 juta banyak bonus tanpa diundi! 5 menit toll JOOR! SHM","Jl MT Haryono, Setu, Bekasi, Jawa Barat","Rp","488 jt","2","1","36 m²","Rp 6.777.778 per m²","tel:+6285697752420","Hubungi"
"Graha Taman Kebayoran Jl Wijaya Raya Tambun Bekasi","Jalan Wijaya Raya Setia Mekar Tambun Bekasi, Bekasi, Bekasi, Jawa Barat","Rp","1,75 M","5","4","200 m²","Rp 5.892.256 per m²","tel:+6281281112008","Hubungi"
"Summarecon Bekasi Cluster Lotus","Lotus Utara, Summarecon Bekasi, Bekasi, Jawa Barat","Rp","4,5 M","5","4","250 m²","Rp 20.833.333 per m²","tel:+6281281112008","Hubungi"
"Summarecon Bekasi Cluster Lotus","Cluster Lotus Selatan, Summarecon Bekasi, Bekasi, Jawa Barat","Rp","4,75 M","5","4","196 m²","Rp 26.388.889 per m²","tel:+6281281112008","Hubungi"
"Summarecon Bekasi Cluster Vernonia","Vernonia Selatan, Bekasi, Bekasi, Jawa Barat","Rp","4,95 M","5","4","198 m²","Rp 19.959.677 per m²","tel:+6281281112008","Hubungi"
"Summarecon Bekasi Cluster Lotus","Cluster Lotus Utara, Summarecon Bekasi, Bekasi, Jawa Barat","Rp","4,5 M","4","4","196 m²","Rp 281.250.000 per m²","tel:+6281281112008","Hubungi"
"Rumah JUal Cepat di Pondok Pekayon Indah, Bekasi","Perumahan Pekayon Indah , Bekasi Selatan, Pondok Pekayon Indah, Bekasi, Jawa Barat","Rp","1,2 M","4","3","160 m²","Rp 10.256.410 per m²","tel:+6281317449989","Hubungi"
"Rumah Model Joglo dan Mezzanine di Margahayu, Bekasi","Jl. Semu Indah, Rawa Semut  Margahayu Bekasi Timu, Bekasi Timur, Bekasi, Jawa Barat","Rp","3,9 M","4","4","370 m²","Rp 8.515.284 per m²","tel:+6281317449989","Hubungi"
"Summarecon Crown Gading, Kota Mandiri  di Utara-Timur Jakarta","Summarecon Crown Gading, Tarumajaya Bekasi, Tarumajaya, Bekasi, Jawa Barat","Rp","2,71395 M","4","4","135 m²","Rp 18.214.430 per m²","tel:+6281317449989","Hubungi"
"Promo merdeka beli rumah DP suka-suka! 15 menit grand wisata cibubur","jl mt hariyono, Setu, Bekasi, Jawa Barat","Rp","440 jt","2","1","42 m²","Rp 7.333.333 per m²","tel:+6285770925266","Hubungi"
"Rumah dalam Cluster Tarumajaya","Jalan Raya Taruma Jaya Raya, Tarumajaya, Bekasi, Jawa Barat","Rp","605 jt","2","1","49 m²","Rp 6.648.352 per m²","tel:+6281380849604","Hubungi"
"Kota Serang Baru",". Jl. Raya Cibarusah, Cikarang, Cikarang, Bekasi, Jawa Barat","Rp","168 jt","2","1","25 m²","Rp 2.800.000 per m²","tel:+6285872033196","Hubungi"
"Harapan Indah",". Jl Bekasi Raya, Medan Satria, Bekasi, Medan Satria, Bekasi, Jawa Barat","Rp","275 jt","2","1","60 m²","Rp 7.638.889 per m²","tel:+6285708254228","Hubungi"
"Dijual Rumah Di Jatiasih, Paling Murah Kokoh Terawat Siap Huni Strategis Dekat Toll JORR Jatiasih Be","Jalan Raya Jatiasih, Jatiasih, Bekasi, Jawa Barat","Rp","1,35 M","4","3","133 m²","Rp 7.714.286 per m²","tel:+6281513463369","Hubungi"
"Rumah BARU TERMURAH Dlm CLUSTER  di Jati Makmur Pondok Gede Bekasi","Jati makmur Pondok Gede Bekasi, Jati Makmur, Bekasi, Jawa Barat","Rp","795 jt","3","2","72 m²","Rp 13.032.787 per m²","tel:+62811127067","Hubungi"
"Kemang Pratama 2","Jl Raya Pekayon, Pekayon, Bekasi, Pekayon Jaya, Bekasi, Jawa Barat","Rp","1,75 M","4","3","150 m²","Rp 12.962.963 per m²","tel:+628129179122","Hubungi"
"Grand Duta City Bekasi","Jl Raya Pulo timaha, Babelan, Bekasi Utara, Bekasi, Jawa Barat","Rp","600 jt - Rp 700 jt","2","1","49 m²","","",""
"grand setu city","jl mt hariyono, Setu, Bekasi, Jawa Barat","Rp","440 jt","2","1","42 m²","Rp 7.333.333 per m²","tel:+628577095266","Hubungi"
"Dijual rumah hook hadap timur selatan luas 135 di Bulevar Hijau, Harapan Indah","Bulevar Hijau, Harapan Indah, Boulevard Hijau, Bekasi, Jawa Barat","Rp","985 jt","2","2","80 m²","Rp 7.296.296 per m²","tel:+6282111313271","Hubungi"
"Mutiara Gading City","Jl. Kaliabang Tengah, Bekasi, Jawa Barat","Rp","439 jt","3","1","37 m²","Rp 7.316.667 per m²","tel:+6282111313271","Hubungi"
"Mutiara Gading City","Jl. Kaliabang Tengah, Bekasi, Jawa Barat","Rp","500 jt","3","1","42 m²","Rp 6.944.444 per m²","tel:+6282111313271","Hubungi"
"Sakura Regency 3","Sakura Regency 3 - Jl. Cipete Raya, Tambun Selatan, Bekasi, Jawa Barat","Rp","1,6 M","4","2","127 m²","Rp 17.777.778 per m²","tel:+6281517887988","Hubungi"
"Rumah baru, New City New Gading, Summarecon Crown Gading","Summarecon Crown Gading, Tarumajaya, Bekasi, Jawa Barat","Rp","952 jt","2","2","50 m²","Rp 17.309.091 per m²","tel:+6282111313271","Hubungi"
"Anabuki Residence","Jl. Parpostel No.21, Bojong Kulur, Jatiasih, Bekasi, Jawa Barat","Rp","1,35 M","3","2","87 m²","Rp 18.750.000 per m²","tel:+6282124799271","Hubungi"
"Rumah murah strategis di Setu bekasi","Bekasi Selatan, Bekasi, Jawa Barat","Rp","365 jt","2","1","36 m²","Rp 6.083.333 per m²","tel:+6285780898960","Hubungi"
"Cluster bekasi utara","Bekasi Utara, Bekasi, Jawa Barat","Rp","477,5 jt","2","1","35 m²","Rp 7.346.154 per m²","tel:+6289693975765","Hubungi"
"Perumnas 1 bekasi","Bekasi Barat, Bekasi, Jawa Barat","Rp","2 M","7","3","155 m²","Rp 12.195.122 per m²","tel:+6289693975765","Hubungi"
"Kota Serang Baru",". Jl. Raya Cibarusah, Cikarang, Cikarang, Bekasi, Jawa Barat","Rp","173 jt","2","1","25 m²","Rp 2.883.333 per m²","tel:+6285872033196","Hubungi"
"Rumah 2 lantai, Vida Bumipala, Bekasi","Cluster Botanica, jl south botanica, Mustikajaya, Bekasi, Jawa Barat","Rp","999,9 jt","4","3","90 m²","Rp 11.903.571 per m²","tel:+6285163166069","Hubungi"
"Premier Estate 2","Jl Raya Kodau, Jati Warna, Bekasi, Jawa Barat","Rp","2 M","3","2","65 m²","","",""
"Kavling Azzahra Residence","JL.Sukamekar,Kec.Sukawangi,Kab.Bekasi, Sukawangi, Bekasi, Jawa Barat","Rp","245 jt","2","1","45 m²","Rp 5.444.444 per m²","tel:+6281386672281","Hubungi"
"Tarumajaya sakinah Residence","JL.Samudra Jaya,Kec.Tarumajaya,Kab.Bekasi, Tarumajaya, Bekasi, Jawa Barat","Rp","280 jt","2","1","36 m²","Rp 4.666.667 per m²","tel:+6281386672281","Hubungi"
"Royal Galaxy Residence","Jl.Palem,Jaka Mulya,Bekasi Kota, Bekasi Selatan, Bekasi, Jawa Barat","Rp","935,445 jt","2","1","40 m²","Rp 13.363.500 per m²","tel:+6281386672281","Hubungi"
"Rumah Rapi siap huni di Perumahan Duta Bumi Harapan Indah Bekasi","Bekasi Barat, Bekasi, Jawa Barat","Rp","925 jt","2","3","80 m²","Rp 10.277.778 per m²","tel:+628111898744","Hubungi"
"Kemang sari, Jatibening baru pondok gede, Bekasi","Kemang sari, Pondokgede, Bekasi, Jawa Barat","Rp","670 jt","2","1","45 m²","Rp 9.305.556 per m²","tel:+6281318542110","Hubungi"
"Pekayon jaya","Jl Raya Pekayon, Pekayon Jaya, Bekasi Selatan, Pekayon Jaya, Bekasi, Jawa Barat","Rp","1,85 M","","","240 m²","Rp 9.390.863 per m²","tel:+6281318542110","Hubungi"
"Cikunir, Jaka Mulya, Bekasi Selatan","Jalan raya cikunir, Bekasi Selatan, Bekasi, Jawa Barat","Rp","750 jt","2","1","58 m²","Rp 10.416.667 per m²","tel:+6281318542110","Hubungi"
"Jatirahayu, pondok gede, Bekasi","Jalan Kusuma indah, Pondokgede, Bekasi, Jawa Barat","Rp","890 jt","3","2","118 m²","Rp 13.692.308 per m²","tel:+6281318542110","Hubungi"
"Jatibening baru, pondok gede","Jatibening baru, Pondokgede, Bekasi, Jawa Barat","Rp","875 jt","4","2","120 m²","Rp 6.835.938 per m²","tel:+6281318542110","Hubungi"
"Jl. Raya kodau, jatimekar, Jatiasih","Jl. Raya kodau, jatimekar, Jatiasih, Jatiasih, Bekasi, Jawa Barat","Rp","900 jt","3","2","85 m²","Rp 11.250.000 per m²","tel:+6281318542110","Hubungi"
"For Sale Rumah Mewah, Perumahan Rafles Cibubur 2 Lantai (Hook)","Bekasi, Bekasi, Jawa Barat","Rp","12,5 M","7","6","1145 m²","Rp 16.711.230 per m²","tel:+6281310646676","Hubungi"
"Dijual Murah Rumah Bagus Seperti Baru Kokoh Terawat Siap Huni Tanah Luas Di Bintara Bekasi Barat","Bintara Bekasi Barat, Bintara, Bekasi, Jawa Barat","Rp","3 M","5","4","141 m²","Rp 10.000.000 per m²","tel:+62811127067","Hubungi"
"Rumah Cluster Baru Modern Deket Hotel Merdeka Tambun Selatan.","Tambun bekasi, Tambun, Bekasi, Jawa Barat","Rp","539 jt","2","1","45 m²","Rp 8.983.333 per m²","tel:+62811127067","Hubungi"
"Legenda Wisata",". Jl. Raya Alternatif Cibubur, Cikeas Udik, Bekasi, Cibubur, Bekasi, Jawa Barat","Rp","1,5 M","2","2","84 m²","Rp 11.194.030 per m²","tel:+6281284480886","Hubungi"
"Rumah Grand Wisata Bekasi","Grand Wisata, Grand Wisata, Bekasi, Jawa Barat","Rp","1,2 M","3","2","65 m²","Rp 18.181.818 per m²","tel:+6281393339935","Hubungi"
"cikunir","Cikunir, Bekasi, Jawa Barat","Rp","2,5 M","4","3","150 m²","Rp 20.833.333 per m²","tel:+6282123672619","Hubungi"
"Rumah Murah Minimalis Modern di Srijaya Tambun Bekasi","Tambun, Bekasi, Jawa Barat","Rp","375 jt","2","1","36 m²","Rp 6.250.000 per m²","tel:+6287789672120","Hubungi"
"Rumah dijual murah di jl Amarilis Kemang Pratama 2 Bekasi Kota","Amarilis, Kemang Pratama, Bekasi, Jawa Barat","Rp","1,7 M","4","2","90 m²","Rp 9.444.444 per m²","tel:+628121058303","Hubungi"
"Rumah Baru Minimalis Modern Free Biaya2 Selangkah Ke Jl Raya Jatiwaringin","Jatiwaringin, Jati Waringin, Bekasi, Jawa Barat","Rp","1,8 M","4","4","180 m²","Rp 14.876.033 per m²","tel:+6281282940124","Hubungi"
"Rumah Minimalis Siap Huni Dekat Toll Di Jakasampurna","Jakasampurna, Jaka Sampurna, Bekasi, Jawa Barat","Rp","780 jt","2","1","45 m²","Rp 10.684.932 per m²","tel:+6281282940124","Hubungi"
"Rumah Dekat Tol Jatiasih Hanya BF 5jt","Kertapawitan Saleh, Jatiasih, Bekasi, Jawa Barat","Rp","800 jt","3","2","56 m²","Rp 12.307.692 per m²","tel:+6287717610879","Hubungi"
"Jababeka Residence","Jababeka Center, Hollywood Plaza No. 10 – 12, Jalan H. Usmar Ismail, Cikarang Utara, Bekasi, Jawa Barat","Rp","643,888 jt","3","2","52 m²","","",""
"Villa Jatirasa","Jl. Wibawa Mukti 2, Jatiasih, Bekasi, Jatiasih, Bekasi, Jawa Barat","Rp","750 jt","5","3","300 m²","Rp 4.285.714 per m²","tel:+62081316163869","Hubungi"
"Grand kota Bintang","Bekasi Barat, Bekasi, Jawa Barat","Rp","1,80042 M","2","1","75 m²","Rp 13.536.992 per m²","tel:+6281290740805","Hubungi"
"Premier Estate 3","Jl. Raya Kranggan, Cibubur, Bekasi, Jawa Barat","Rp","1,8 M","2","2","54 m²","","",""
"Bintara jaya","Bintara jaya, Bekasi Barat, Bekasi, Jawa Barat","Rp","300 jt","2","1","40 m²","Rp 6.000.000 per m²","tel:+6281282368530","Hubungi"
"Rumah Cantik gratis furnish fre biaya bonus mobil expander Timur jakarta","Jl lindung, Jatisampurna, Bekasi, Jawa Barat","Rp","2,5 M","5","4","160 m²","Rp 22.522.523 per m²","tel:+6285861175230","Hubungi"
"Rumah Aparhouse 3 lantai free biaya bonus logam mulia dekat gt jatiasih","jatiasih, Jatiasih, Bekasi, Jawa Barat","Rp","1.285 M","3","3","110 m²","Rp 21.416.666.667 per m²","tel:+6285861175230","Hubungi"
"Rumah Dua lantai fre biaya dekat gerbang tol jati aasih","Bekasi Selatan, Bekasi, Jawa Barat","Rp","1,285 M","3","3","110 m²","Rp 21.416.667 per m²","tel:+6285861175230","Hubungi"
"Rumah murah Tiga lantai fre biaya siap huni d bekasi","asih 1, Bekasi Selatan, Bekasi, Jawa Barat","Rp","1,285 rb","3","3","110 m²","Rp 21 per m²","tel:+6285861175230","Hubungi"
"Cluster Cherryville Grand Wisata Bekasi","Jl. Bima Utama Raya, Lambang Sari, Tambun, Bekasi, Jawa Barat","Rp","1,83603904 M","4","3","100 m²","Rp 14.571.738 per m²","tel:+6285694939700","Hubungi"
"Legenda Wisata",". Jl. Raya Alternatif Cibubur, Cikeas Udik, Bekasi, Cibubur, Bekasi, Jawa Barat","Rp","2,223 M","4","3","150 m²","Rp 11.227.273 per m²","tel:+6281212336678","Hubungi"
"Grand Wisata Cluster Z Living","Jl. Western Boulevard Grand Wisata Bekasi, Bekasi, Bekasi, Jawa Barat","Rp","1,33036265 M","3","3","88 m²","Rp 20.157.010 per m²","tel:+6285694939700","Hubungi"
"Grand Wisata Cluster Z Living Type Life Style","Jl. Western Boulevard, Mustikajaya, Bekasi, Jawa Barat","Rp","2,3 M","5","4","125 m²","Rp 16.428.571 per m²","tel:+6285694939700","Hubungi"
"grand setu city","jl mt hariyono, Setu, Bekasi, Jawa Barat","Rp","440 jt","2","1","42 m²","Rp 7.333.333 per m²","tel:+6285158636623","Hubungi"
"Rumah Baru Cantik Siap Huni di Jatiwaringin, Bekasi","Raya Jatiwaringin, Jati Waringin, Bekasi, Jawa Barat","Rp","1,63 M","4","3","113 m²","Rp 14.298.246 per m²","tel:+6281299228901","Hubungi"
"2 lantai pinggir jalan raya di jatiasih","Jl. Wibawa Mukti 2, Jatiasih, Bekasi, Jati Sari, Bekasi, Jawa Barat","Rp","656 jt","3","2","60 m²","Rp 11.927.273 per m²","tel:+6289687911519","Hubungi"
"Rumah baru dalam cluster di jati makmur pondok gede Bekasi","Jln, Bekasi Selatan, Bekasi, Jawa Barat","Rp","795 jt","3","2","72 m²","Rp 13.032.787 per m²","tel:+6282190795325","Hubungi"
"Dijual cepat rumah termurah di cluster harmoni harapan indah","Harapan Indah, Bekasi, Jawa Barat","Rp","1,09 M","3","2","105 m²","Rp 10.380.952 per m²","tel:+6281311338893","Hubungi"
"Dijual Rumah Dua lantai di Vassa Residence Lippo Cikarang","Jl. Bukit Indah Boulevard No. 9, Lippo Cikarang, Bekasi, Jawa Barat","Rp","3,2 M","3","3","200 m²","Rp 16.000.000 per m²","tel:+6285210947428","Hubungi"
"Rumah Siap Huni Cluster Vassa Terrace","Jl. Bukit Indah Boulevard No. 9, Lippo Cikarang, Bekasi, Jawa Barat","Rp","3,2 M","3","3","230 m²","Rp 16.000.000 per m²","tel:+6285210947428","Hubungi"
"Galaxy bekasi selatan","Bekasi selatan, Bekasi, Bekasi, Jawa Barat","Rp","2,5 M","4","5","400 m²","Rp 12.500.000 per m²","tel:+6289693975765","Hubungi"
"Rumah dijual murah di Taman harapan baru Harapan Indah Bekasi","Taman harapan baru, Harapan Indah, Bekasi, Jawa Barat","Rp","1,19 M","4","2","100 m²","Rp 5.950.000 per m²","tel:+62816669062","Hubungi"
"Rumah dijual murah di cluster adara harapan indah","Harapan indah, Harapan Indah, Bekasi, Jawa Barat","Rp","1,49 M","3","3","70 m²","Rp 13.796.296 per m²","tel:+62816669062","Hubungi"
"Dijual Rumah murah di segara city bekasi","Segara City Segara city, Bekasi Utara, Bekasi, Jawa Barat","Rp","550 jt","2","1","45 m²","Rp 6.111.111 per m²","tel:+62816669062","Hubungi"
"Hunian nyaman jatiasih bekasi","Pasar rebo, Galaxy, Bekasi, Jawa Barat","Rp","1,691 M","3","3","138 m²","Rp 21.137.500 per m²","tel:+6283805387996","Hubungi"
"Cibubur Country Royal Wood","Jl. Letda Natsir No. 8 Cikeas Udik, Bekasi, Bekasi, Jawa Barat","Rp","1,08 M","2","2","78 m²","Rp 15.000.000 per m²","tel:+628568712220","Hubungi"
"RUMAH BALSA GREEN ARA RESIDENCE UK 7x21, STANDAR DEVELOPER, JUAL MUARHHHH","Bekasi barat, Bekasi Barat, Bekasi, Jawa Barat","Rp","1,65 M","2","1","51 m²","Rp 11.224.490 per m²","tel:+628159007730","Hubungi"
"Rumah murah 265 jt di Babelan Bekasi","Jl Kampung Asem Babelan Bekasi, Bekasi Utara, Bekasi, Jawa Barat","Rp","275 jt","2","1","40 m²","Rp 5.500.000 per m²","tel:+6281212335979","Hubungi"
"Jual Rumah Siap Huni Lokasi Strategis Dekat Jatiasih Bekasi Harga Nego Siap KPR","Jl. Mesjid Al Arafiyah Jatibening Baru, Jatiasih, Bekasi, Jawa Barat","Rp","1,17 M","4","2","100 m²","Rp 7.905.405 per m²","tel:+6282125399395","Hubungi"
"Rumah Dijual di Cluster Summarecon Bekasi","Bekasi, Bekasi, Jawa Barat","Rp","2,2 M","4","4","132 m²","Rp 17.460.317 per m²","tel:+628111898744","Hubungi"
"Vila Indah Permai","Jl Kaliabang, Teluk Pucung, Bekasi Utara, Teluk Pucung, Bekasi, Jawa Barat","Rp","400 jt","2","1","40 m²","Rp 6.666.667 per m²","tel:+628121173111","Hubungi"
"Bintang Metropole","Jl. H. Tabrani, Marga Mulia, Bekasi Selatan, Bekasi Selatan, Bekasi, Jawa Barat","Rp","700 jt","2","1","70 m²","Rp 8.974.359 per m²","tel:+628121173111","Hubungi"
"Di Jual Cluster Khalas Cikarang utara","Karang asih Cikarang utara, Cikarang Utara, Bekasi, Jawa Barat","Rp","400 jt","2","1","36 m²","Rp 5.555.556 per m²","tel:+6282122211939","Hubungi"
"Dijual Rumah Baru Dalam Cluster Strategis Dekat Tol Jatiasih Bekasi","Jatiasih, Bekasi, Jawa Barat","Rp","790 jt","2","1","53 m²","Rp 7.900.000 per m²","tel:+628118450300","Hubungi"
"Dijual Rumah Dalam Cluster Siap Huni Strategis di Jatisari Jatiasih Bekasi","Jati Sari, Bekasi, Jawa Barat","Rp","600 jt","2","1","50 m²","Rp 7.692.308 per m²","tel:+628118450300","Hubungi"
"DIJUAL MURAH RUMAH 2 LANTAI LOKASI NEMPEL JL RAYA BINTARA 8","Jl Bintara Jaya 8, Bintara Jaya, Bekasi, Jawa Barat","Rp","850 jt","3","2","128 m²","Rp 13.281.250 per m²","tel:+6285782036932","Hubungi"
"DIJUAL MURAH RUMAH LUXURY 2 LANTAI CLUSTER BINTARA LOKASI STRATEGIS DEKAT EXIT TOL JORR KALIMALANG","Jl Bintara Jaya, Bintara, Bekasi, Jawa Barat","Rp","850 jt","3","2","120 m²","Rp 13.281.250 per m²","tel:+6285782036932","Hubungi"
"JUAL MURAH RUMAH EXCLUSIVE 2 LANTAI PELANGI RESIDENCE SELANGKAH KE TOL JORR BINTARA DAN TOL BECAKAYU","Jl Bintara 11, Bintara Jaya, Bekasi, Jawa Barat","Rp","1,18 M","3","2","60 m²","Rp 15.526.316 per m²","tel:+6285782036932","Hubungi"
"RUMAH EXCLUSIVE  TERMURAH DI BINTARA BEKASI BARAT PELANGI RESIDENCE DEKAT TOL JORR PONDOK KELAPA","Jl Bintara 11, Bintara, Bekasi, Jawa Barat","Rp","1,18 M","3","2","60 m²","Rp 15.526.316 per m²","tel:+6285782036932","Hubungi"
"JUAL MURAH RUMAH 2 LANTAI DI BINTARA LOKASI STRATEGIS SELANGKAH KE PONDOK KELAPA JAKARTA TIMUR","Jl Bintara Jaya, Bintara, Bekasi, Jawa Barat","Rp","580 jt","3","2","96 m²","Rp 12.083.333 per m²","tel:+6285782036932","Hubungi"
"DIJUAL MURAH RUMAH MINIMALIS 2 LANTAI Akses Jalan Mobil","Jl Bintara 12, Bintara Jaya, Bekasi, Jawa Barat","Rp","580 jt","3","2","96 m²","Rp 12.083.333 per m²","tel:+6285782036932","Hubungi"
"JUAL MURAH RUMAH 1 LT BEBAS BANJIR LOKASI STRATEGIS DEKAT PLAZA PONDOK GEDE","Jl Raya Jatiwarna, Pondokgede, Bekasi, Jawa Barat","Rp","700 jt","3","2","90 m²","Rp 6.363.636 per m²","tel:+6285782036932","Hubungi"
"Rumah Kemang Pratama, Bekasi","Kemang Pratama, Kemang Pratama, Bekasi, Jawa Barat","Rp","1,7 M","3","2","90 m²","Rp 9.444.444 per m²","tel:+6281393339935","Hubungi"
"Dijual Rumah Siap Huni, 700 jutaan, DP bisa dicicil 4 kali di Jatisari","bekasi, Jati Sari, Bekasi, Jawa Barat","Rp","751 jt","3","2","65 m²","Rp 11.378.788 per m²","tel:+6285156349533","Hubungi"
"Casturi Residence Syariah","Jl.MT Haryono, Setu, Bekasi, Jawa Barat","Rp","335 jt","2","1","40 m²","Rp 4.785.714 per m²","tel:+6282172890031","Hubungi"
"BEKASI","Villa Gading Harapan 1, Bekasi Utara, Bekasi, Jawa Barat","Rp","355 jt","2","1","54 m²","Rp 5.916.667 per m²","tel:+6281364323399","Hubungi"
"Rumah baru di jalan utama jatiasih","Wibawamukti, Jatiasih, Bekasi, Jawa Barat","Rp","706,25 jt","2","2","60 m²","Rp 12.840.909 per m²","tel:+6281808870036","Hubungi"
"Rumah minimalis modern di Mustikajaya","Raya Mustikajaya, Mustikajaya, Bekasi, Jawa Barat","Rp","839 jt","3","2","58 m²","Rp 13.754.098 per m²","tel:+6281808870036","Hubungi"
"Rumah murah di Jatiasih","Sirojul Munir, Jatiasih, Bekasi, Jawa Barat","Rp","400 jt","2","1","36 m²","Rp 7.843.137 per m²","tel:+6281808870036","Hubungi"
"jatibening baru","jl nangka jatibening baru, Jati Bening, Bekasi, Jawa Barat","Rp","1,75 M","4","3","211 m²","Rp 9.615.385 per m²","tel:+6285280316061","Hubungi"
"rumah mewah jatisari Indah Jati asih bekasi kota","jalan swatantra jatisari jatiasih bekasi kota, Jatiasih, Bekasi, Jawa Barat","Rp","7,75 M","6","7","1400 m²","Rp 11.071.429 per m²","tel:+6285280316061","Hubungi"
"Perumhan Mas Naga Galaxy jaka Setia Bekasi Selatan","Masa naga Galaxy, Galaxy, Bekasi, Jawa Barat","Rp","2,5 M","5","2","202 m²","Rp 13.888.889 per m²","tel:+6285280316061","Hubungi"
"jaladha pura bulak kapal bekasi timur","Bekasi Timur, Bekasi, Jawa Barat","Rp","2,75 jt","7","4","211 m²","Rp 12.222 per m²","tel:+6285280316061","Hubungi"
"Green Jati Kartika 2","Wibawa mukti, Jatiasih, Bekasi, Jawa Barat","Rp","599,75 jt","2","1","50 m²","Rp 8.329.861 per m²","tel:+6285280316061","Hubungi"
"jatisari jatikramat jatiasih bekasi kota","wibawa mukti, Jatiasih, Bekasi, Jawa Barat","Rp","600 jt","2","1","50 m²","Rp 8.333.333 per m²","tel:+6285280316061","Hubungi"
"Rumah Tinggal Jatibening Dalam Komplek Siap Ditempati","Jalan raya Ratna jatibening, Jati Bening, Bekasi, Jawa Barat","Rp","2,4 M","5","6","247 m²","Rp 12.182.741 per m²","tel:+628128975665","Hubungi"
"Rumah siap huni di ifolia","Harapan Indah, Bekasi, Jawa Barat","Rp","1 M","3","2","36 m²","Rp 7.936.508 per m²","tel:+6282211111976","Hubungi"
"Kota Harapan Indah Cluster Taman Sari","Jl. Bekasi Raya, Medan Satria, Bekasi, Medan Satria, Bekasi, Jawa Barat","Rp","1,9 M","4","3","124 m²","Rp 15.322.581 per m²","tel:+6282211111976","Hubungi"
"Di Jual Rumah baru  mewah 2 lantai mewah Kokoh dalam cluster di Kodau jatimekar dekat Tol Jati Warna","Jati Warna, Bekasi, Jawa Barat","Rp","1,25 M","3","2","100 m²","Rp 15.625.000 per m²","tel:+6281213378651","Hubungi"
"Rumah di Jual Idaman dan Cantik di Cikarang, Bekasi","Cikarang, Bekasi, Jawa Barat, Cikarang, Bekasi, Jawa Barat","Rp","485 jt","2","1","54 m²","Rp 6.736.111 per m²","tel:+6281293280655","Hubungi"
"Dito Grand Mansion","Jalan Cipete Raya, Bekasi Timur, Bekasi, Jawa Barat","Rp","850 jt","3","1","70 m²","Rp 6.439.394 per m²","tel:+6281380934607","Hubungi"
