"nav-link","listing-location","currency","price","bed","bath","listing-floorarea","listing-floorarea 2","hidden-sm href 2","hidden-sm 2"
"Perumahan Taman Satria Jaya Indah - Tambun Utara","Jalan Raya kali Busa, Tambun Utara, Bekasi, Jawa Barat","Rp","440 jt","2","1","42 m²","Rp 6.111.111 per m²","tel:+6282113095016","Hubungi"
"Summarecon Bekasi","Cluster Bluebell Summarecon Bekasi, Summarecon Bekasi, Bekasi, Jawa Barat","Rp","2,85 M","5","4","157 m²","Rp 18.627.451 per m²","tel:+6281281112008","Hubungi"
"Magenta Residance Summarecon Bekasi",". Jl. Perjuangan Raya, Harapan Mulya, Bekasi Barat, Bekasi, Jawa Barat","Rp","1,48074 jt","3","2","76 m²","Rp 22.435 per m²","tel:+6281211137186","Hubungi"
"Emerald Terrace Jatiasih",". Jl. Wibawa Mukti 2, Jatiasih, Bekasi, Jawa Barat","Rp","900 jt","4","2","51 m²","Rp 15.000.000 per m²","tel:+6281211137186","Hubungi"
"JUAL CEPAT RUMAH TYTYAN INDAH Dekat Stasiun & Tol Siap Huni","Bekasi Utara, Bekasi, Jawa Barat","Rp","725 jt","3","1","90 m²","Rp 6.712.963 per m²","tel:+6282112544320","Hubungi"
"RUMAH KEMANG PRATAMA 3 LANTAI","Bekasi Barat, Bekasi, Jawa Barat","Rp","1,5 M","5","4","180 m²","Rp 13.888.889 per m²","tel:+6282112544320","Hubungi"
"Summarecon Crown Gading Tarumajaya Bekasi","Jl. Taruma Jaya, Setia Asih, Bekasi, Bekasi, Bekasi, Jawa Barat","Rp","952 jt","3","2","69 m²","Rp 17.309.091 per m²","tel:+6281211137186","Hubungi"
"Rumah Murah  diJatiasih","Jalan Bina asih 2, Galaxy, Bekasi, Jawa Barat","Rp","1,7 M","3","3","138 m²","Rp 21.250.000 per m²","tel:+6283805387996","Hubungi"
"Galaxy","Mas Naga, Bekasi, Jawa Barat","Rp","1,25 M","5","2","165 m²","Rp 8.928.571 per m²","tel:+6281283159090","Hubungi"
"Di Jual Rumah Baru 2 LT Minimalis Modern Selangkah ke gerbang toll becakayu  Bekasi","Kalimalang jakasampurna Bekasi Barat, Bekasi Barat, Bekasi, Jawa Barat","Rp","1,535 M","3","2","88 m²","Rp 20.466.667 per m²","tel:+6281315606551","Hubungi"
"Di Jual Rumah second siap huni di Komplek Kemang Pratama Bekasi","Kemang Pratama Bekasi, Bekasi, Bekasi, Jawa Barat","Rp","3.500 M","5","3","314 m²","Rp 12.195.121.951 per m²","tel:+6281315606551","Hubungi"
"Harapan indah asera","Harapan Indah, Bekasi, Jawa Barat","Rp","2,15 M","4","4","157 m²","Rp 14.930.556 per m²","tel:+6281323230177","Hubungi"
"Rumah Brand New di Harapan Indah 1","Harapan Indah, Bekasi, Jawa Barat","Rp","900 jt","3","2","90 m²","Rp 8.181.818 per m²","tel:+6282211111976","Hubungi"
"Summarecon Bekasi","Summarecon Bekasi, Harapan Baru, Bekasi Utara, Kota Bekasi, Jawa Barat, Bekasi Utara, Bekasi, Jawa Barat","Rp","2,7 M","4","3","325 m²","Rp 11.297.071 per m²","tel:+6287785400570","Hubungi"
"Rumah Fully Furnished Elektronik Citra Gran Cibubur Bekasi","jl citragran cibubur, jatikarya,kota wisata, Cibubur, Bekasi, Jawa Barat","Rp","1,5 M","3","2","67 m²","Rp 20.833.333 per m²","tel:+6281380003807","Hubungi"
"Sakura Regency 3","Jl. Cipete Raya, Tambun Selatan, Bekasi, Jawa Barat","Rp","1,4 M","3","2","67 m²","Rp 12.500.000 per m²","tel:+6281517887988","Hubungi"
"Graha Asri Cikarang","Jl. Cisadane Raya Simpangan Bekasi, Cikarang, Bekasi, Jawa Barat","Rp","1,25 M","2","1","120 m²","Rp 10.416.667 per m²","tel:+628159552552","Hubungi"
"Rumah baru minimalis modern bebas banjir dn strategis dkt tol Jatibening","Jl. Cikunir raya, Bekasi Selatan, Bekasi, Jawa Barat","Rp","2,25 M","7","7","255 m²","Rp 12.032.086 per m²","tel:+628129035434","Hubungi"
"Rumah 2 lantai dlm cluster jatikramat dkt sentrakota, jatibening, pondok gede","Jl. raya mesjid, Jati Bening, Bekasi, Jawa Barat","Rp","925 jt","3","2","90 m²","Rp 11.280.488 per m²","tel:+628129035434","Hubungi"
"Rumah Taman Galaxy Indah Bekasi Selatan","Pulo sirih, Bekasi Selatan, Bekasi, Jawa Barat","Rp","1,12 M","4","2","150 m²","Rp 9.572.650 per m²","tel:+6281281870070","Hubungi"
"Bukit Cijingga Indah","Jl Cijingga ,Serang Cikarang Selatan Bekasi, Cikarang Selatan, Bekasi, Jawa Barat","Rp","418 jt","2","1","38 m²","Rp 6.966.667 per m²","tel:+6285777502673","Hubungi"
"Metland Cibitung",". Jl. Selang Narogong, Cibitung, Bekasi, Jawa Barat","Rp","560 jt","2","1","45 m²","Rp 7.777.778 per m²","tel:+6285777502673","Hubungi"
"Pesona Verbena Babelan","Jl Panjibuono Kedungjaya, Babelan, Bekasi, Jawa Barat","Rp","380 jt","2","1","36 m²","Rp 6.333.333 per m²","tel:+6285777502673","Hubungi"
"Bukit Cijingga Indah","Jl Cijingga serang, Cikarang Selatan, Cikarang Selatan, Bekasi, Jawa Barat","Rp","479 jt","2","1","45 m²","Rp 6.652.778 per m²","tel:+6285777502673","Hubungi"
"Jatiasih","Jl Jepara kp Benda, Jati Sari, Bekasi, Jawa Barat","Rp","600 jt","2","1","75 m²","Rp 7.058.824 per m²","tel:+6281546080420","Hubungi"
"Di Jual Gardenia city 3 Cibitung Dekat Stasiun","Bulak kunyit, Cibitung, Bekasi, Jawa Barat","Rp","168 jt","2","1","30 m²","Rp 2.800.000 per m²","tel:+6282122211939","Hubungi"
"Di Jual Shamandra gardenia","Jl raya Cikarang, Cikarang Utara, Bekasi, Jawa Barat","Rp","179 jt","2","1","30 m²","Rp 2.983.333 per m²","tel:+6282122211939","Hubungi"
"Di Jual Mutiara Citra Residence2 Mcr","Jl raya cikarang, Karangbahagia, Bekasi, Jawa Barat","Rp","168 jt","2","1","27 m²","Rp 2.800.000 per m²","tel:+6282122211939","Hubungi"
"RUMAH MEWAH APARHOUSE 3 lantai BONUS MOTOR","jln asih, Jati Warna, Bekasi, Jawa Barat","Rp","1.285 M","3","3","110 m²","Rp 21.416.666.667 per m²","tel:+6285861175230","Hubungi"
"Rumah Mewah 3lantai cukup booking  10 juta dekat gerbang tol jati asih","komsen, Galaxy, Bekasi, Jawa Barat","Rp","1,7 M","3","3","138 m²","Rp 21.250.000 per m²","tel:+6285861175230","Hubungi"
"RUMAH MEWAH JATIASIH BONUS MOBIL","wibawa mukti jasiasih, Jatiasih, Bekasi, Jawa Barat","","900","2","2","51 m²","Rp 15 per m²","tel:+6281289746101","Hubungi"
"Rumah jatisampurna Murah Dp 2Jt All in","Jatisampurna, Bekasi, Jawa Barat","","999","3","2","60 m²","Rp 11 per m²","tel:+6281289746101","Hubungi"
"Rumah cantik fre biaya lokasi strategis 1kilo ke gerbang tol jatiasih","Jatiasih, Bekasi, Jawa Barat","Rp","1,69 M","3","3","138 m²","Rp 21.125.000 per m²","tel:+6285861175230","Hubungi"
"Di jual Rumah Elegant siap huni 5mnit ke gerbang tol jatiasih","jatiasih, Cibubur, Bekasi, Jawa Barat","Rp","1,691 M","3","3","138 m²","Rp 21.137.500 per m²","tel:+6285861175230","Hubungi"
"Jatiwaringin pondok gede","Jati Waringin, Bekasi, Jawa Barat","Rp","2,7 M","5","5","200 m²","Rp 16.167.665 per m²","tel:+6281311338893","Hubungi"
"Rumah termurah di lippo cikarang","Cikarang Barat, Bekasi, Jawa Barat","Rp","1,15 M","4","2","150 m²","Rp 10.267.857 per m²","tel:+6281311338893","Hubungi"
"Perumahan green park Jatiwarna pondok melati Bekasi","Jati Warna, Bekasi, Jawa Barat","Rp","3,6 M","4","5","300 m²","Rp 16.666.667 per m²","tel:+6281311338893","Hubungi"
"Dijual Rumah Siap Huni di Cluster Aralia Harapan Indah Bekasi","Harapan Indah, Bekasi, Jawa Barat","Rp","1,7 M","4","4","280 m²","Rp 10.625.000 per m²","tel:+6281311338893","Hubungi"
"Cluster ifolia harapan indah Bekasi","Harapan Indah, Bekasi, Jawa Barat","Rp","1,15 M","4","3","126 m²","Rp 9.126.984 per m²","tel:+6281311338893","Hubungi"
"Dijual Rumah Murah Jarang Ada di Cluster Lotus 8 Premium Summarecon Bekasi","Summarecon Bekasi, Bekasi, Jawa Barat","Rp","2,375 M","3","3","145 m²","Rp 16.493.056 per m²","tel:+6281311338893","Hubungi"
"Rumah mewah hook jual cepat di bulevar hijau","Jalan Boulevard Hijau Raya, Boulevard Hijau, Bekasi, Jawa Barat","Rp","3,1 M","5","5","755 m²","Rp 8.244.681 per m²","tel:+6281311338893","Hubungi"
"Aldiva Residence","Aldiva Residence, Mustikajaya, Bekasi, Jawa Barat","Rp","650 jt","2","1","50 m²","Rp 9.848.485 per m²","tel:+6281380934607","Hubungi"
"Kota Harapan Indah","Jl Bekasi Raya, Bekasi, Bekasi, Jawa Barat","Rp","1,9 M","4","3","141 m²","Rp 9.743.590 per m²","tel:+6282112389619","Hubungi"
"Grand Wisata Bekasi","Jl. Jalan Western Boulevard, Tambun, Bekasi, Jawa Barat","Rp","2,73 M","6","4","155 m²","Rp 18.958.333 per m²","tel:+6285694939700","Hubungi"
"SUMMARECON CROWN GADING BEKASI UTARA","Summarecon Bekasi, Bekasi Utara, Bekasi, Jawa Barat","Rp","952 jt","3","3","50 m²","Rp 17.309.091 per m²","tel:+6281268889987","Hubungi"
"SUMMARECON CROWN GADING BEKASI","Summarecon Bekasi, Bekasi, Bekasi, Jawa Barat","Rp","952 jt","3","3","50 m²","Rp 17.309.091 per m²","tel:+6281268889987","Hubungi"
"SUMMARECON CROWN GADING BEKASI","Summarecon Bekasi, Harapan Indah, Bekasi, Jawa Barat","Rp","952 jt","3","3","50 m²","Rp 17.309.091 per m²","tel:+6281268889987","Hubungi"
"SUMMARECON CROWN GADING BEKASI","Summarecon Bekasi, Babelan, Bekasi, Jawa Barat","Rp","952 jt","3","3","50 m²","Rp 17.309.091 per m²","tel:+6281268889987","Hubungi"
"Rumah cluster dijual di jatisampuna Bekasi dekat kampus mercubuana dan tol jatiwarna","Jln, Bekasi Selatan, Bekasi, Jawa Barat","Rp","910 jt","3","2","63 m²","Rp 14.918.033 per m²","tel:+6282190795325","Hubungi"
"Di jual cepat  rumah bangunan baru harga nego di harapan indah bekasi","Cempaka raya, Harapan Indah, Bekasi, Jawa Barat","Rp","575 jt","2","1","50 m²","Rp 8.984.375 per m²","tel:+6287877383791","Hubungi"
"Yuk beli rumah di bulan MERDEKA! DPnya bisa suka-suka! Setu, Bekasi","JL MT HARYONO, Setu, Bekasi, Jawa Barat","Rp","440 jt","2","1","42 m²","Rp 7.333.333 per m²","tel:+6285697752533","Hubungi"
"Dijual rumah hook bebas banjir hook","Bekasi Timur, Bekasi, Jawa Barat","Rp","990 jt","2","1","42 m²","Rp 7.443.609 per m²","tel:+6282111783552","Hubungi"
"Dijual rumah bebas banjir lokasi sangat strategis","Jati Mulya, Bekasi, Jawa Barat","Rp","619,4 jt","2","1","36 m²","Rp 8.602.778 per m²","tel:+6282111783552","Hubungi"
"RUMAH 2 LANTAI DEKAT MALL DI BEKASI","Jl. Western Boulevard, Bekasi Barat, Bekasi, Jawa Barat","Rp","2,529687925 M","4","3","125 m²","Rp 18.069.199 per m²","tel:+6281315397918","Hubungi"
"RUMAH 2 LANTAI DEKAT MALL DI BEKASI","Jl. Western Boulevard, Grand Wisata, Bekasi, Jawa Barat","Rp","2,529687925 M","5","4","125 m²","Rp 18.069.199 per m²","tel:+6281315397918","Hubungi"
"RUMAH VIEW DANAU TANPA DP DI BEKASI","Jl. Western Boulevard Grand Wisata, Bekasi Utara, Bekasi, Jawa Barat","Rp","2,806304531 M","6","4","155 m²","Rp 19.488.226 per m²","tel:+6281315397918","Hubungi"
"RUMAH VIEW DANAU TANPA DP DI BEKASI","Jl. Western Boulevard, Bekasi Timur, Bekasi, Jawa Barat","Rp","2,806304531 M","6","4","155 m²","Rp 19.488.226 per m²","tel:+6281315397918","Hubungi"
"RUMAH MILENIALS GRAND WISATA BEKASI","Jl. Western Boulevard, Bekasi Timur, Bekasi, Jawa Barat","Rp","1,641 M","3","3","88 m²","Rp 24.863.636 per m²","tel:+6281315397918","Hubungi"
"Dijual rumah bebas banjir lokasi sangat strategis","Mustikajaya, Bekasi, Jawa Barat","Rp","619,4 jt","2","1","36 m²","Rp 8.602.778 per m²","tel:+6282111783552","Hubungi"
"Tanpa DP, Free Biaya-biaya di Cluster 2 Lantai Eksklusif","Jaraden, Jatisampurna, Jatisampurna, Bekasi, Jawa Barat","Rp","769,0001 jt","3","2","60 m²","Rp 10.680.557 per m²","tel:+6289503910890","Hubungi"
"Rumah DP 0% Siap Huni di Setu Bekasi","Jl. Jl Ps. Kojengkang, Setu, Bekasi, Jawa Barat","Rp","390 jt","2","1","36 m²","Rp 5.416.667 per m²","tel:+6287717610879","Hubungi"
"Tanpa DP, Free Biaya-biaya di Cluster 2 Lantai Eksklusif","Jatiraden, jatisampurna, Cibubur, Bekasi, Jawa Barat","Rp","769,0002 jt","3","2","60 m²","Rp 10.680.558 per m²","tel:+6289503910890","Hubungi"
"Grand Galaxy City",". Jl Galaxy Raya, Jakasetia, Bekasi Selatan, Galaxy, Bekasi, Jawa Barat","Rp","750 jt","2","2","72 m²","Rp 8.928.571 per m²","tel:+6285702645852","Hubungi"
"Di jual rumah milenial Grand Duta City 3 kmar tidur","Jl. Boulevard Grand Duta City, Babelan, Bekasi, Jawa Barat","Rp","1,3 M","3","2","88 m²","Rp 12.380.952 per m²","tel:+6282150177779","Hubungi"
"Rumah Dp 0% di Bekasi Utara","Bekasi Utara, Bekasi, Jawa Barat","Rp","300 jt","2","1","36 m²","Rp 5.000.000 per m²","tel:+62811915620","Hubungi"
"Rumah Dp 0% Dekat Jakarta Utara","Bekasi Utara, Bekasi, Jawa Barat","Rp","375 jt","2","1","36 m²","Rp 6.250.000 per m²","tel:+62811915620","Hubungi"
"Rumah Tanpa Dp","Bekasi Utara, Bekasi, Jawa Barat","Rp","375 jt","2","1","36 m²","Rp 6.250.000 per m²","tel:+62811915620","Hubungi"
"Lippo Cikarang","Jl. MH. Thamrin, Kel. Sukaresmi Cibatu Serang, Cikarang Selatan, Bekasi, Jawa Barat","Rp","780 jt","2","2","55 m²","Rp 13.000.000 per m²","tel:+6282122313027","Hubungi"
"Lippo Cikarang","Jl. MH. Thamrin, Kel. Sukaresmi Cibatu Serang, Cikarang Selatan, Bekasi, Jawa Barat","Rp","2,250308 M","3","3","105 m²","Rp 10.466.549 per m²","tel:+6282122313027","Hubungi"
"Jual Cepat Rumah Minimalis Strategis Dekat Grand Wisata Harga All In Bisa KPR","Grand Wisata, Bekasi, Jawa Barat","Rp","1,17 M","2","2","120 m²","Rp 10.263.158 per m²","tel:+6282125399395","Hubungi"
"Dijual Rumah Cantik 2 Lantai di Permata Wisata Siap Huni Siap KPR Harga All In","Mustikajaya, Bekasi, Jawa Barat","Rp","1,17 M","2","2","120 m²","Rp 10.263.158 per m²","tel:+6282125399395","Hubungi"
"Rumah Murah di Ujung Harapan Bekasi 265 jt cash","Jl Ujung Harapan, Babelan, Bekasi, Jawa Barat","Rp","275 jt","2","1","40 m²","Rp 5.500.000 per m²","tel:+6281212335979","Hubungi"
"Grand Wisata Boulevard","Jl. Bima Utama Raya, Lambang Sari, Tambun, Bekasi, Jawa Barat","Rp","1,577 M","3","3","88 m²","Rp 23.893.939 per m²","tel:+6283819403634","Hubungi"
"Grand Wisata Bekasi Cherryville 2","Tambun, Bekasi, Jawa Barat","Rp","1,88 M","4","3","100 m²","Rp 13.428.571 per m²","tel:+6283819403634","Hubungi"
"Pondok Pekayon Indah","Jl Raya Pekayon, Pekayon, Bekasi, Pondok Pekayon Indah, Bekasi, Jawa Barat","Rp","1,1 M","2","2","150 m²","Rp 11.224.490 per m²","tel:+6281385924277","Hubungi"
"Bekasi, Pondok Pekayon indah","PPI, Pekayon Jaya, Bekasi, Jawa Barat","Rp","900 jt","4","2","120 m²","Rp 10.000.000 per m²","tel:+6283807100830","Hubungi"
"1 Rumah mewah dijakasetia galaxy bekasi","Jln boulevard jakasetia galaxy bekasi jawabarat, Galaxy, Bekasi, Jawa Barat","Rp","2,5 M","4","5","400 m²","Rp 12.500.000 per m²","tel:+6285263283888","Hubungi"
"TERMURAH RUMAH CANTIK HARAPAN INDAH FURNISHED BEBAS BANJIR","Harapan Indah, Bekasi, Jawa Barat","Rp","850 jt","2","1","50 m²","Rp 12.686.567 per m²","tel:+6282112544320","Hubungi"
"MORIZEN SUMMARECON BEKASI","CLUSTER MORIZEN, Bekasi Barat, Bekasi, Jawa Barat","Rp","2,8 M","4","4","151 m²","Rp 21.538.462 per m²","tel:+62818525122","Hubungi"
"Jati sampurna","Jatisampurna, Bekasi, Jawa Barat","Rp","981 jt","3","2","72 m²","Rp 16.350.000 per m²","tel:+6287785677796","Hubungi"
"Cluster Bintara Jaya","Jl Bintara Jaya Vlll, Bintara Jaya, Bekasi Barat, Bintara Jaya, Bekasi, Jawa Barat","Rp","850 jt","3","2","100 m²","Rp 14.166.667 per m²","tel:+628568642729","Hubungi"
"Rumah murah fasilitas kolam renang Jatisampurna Bekasi diapit 4 pintu tol jatiasih jatiwarna cibubur","Jatisampurna, Bekasi, Jawa Barat","Rp","1,08 M","3","2","77 m²","Rp 12.857.143 per m²","tel:+6285697446664","Hubungi"
"Cluster Heliconia Extention","Harapan Indah, Bekasi, Jawa Barat","Rp","3,5 M","5","4","400 m²","Rp 11.326.861 per m²","tel:+6282211111976","Hubungi"
"Cluster cantik jati asih","Jatiasih, Bekasi, Jawa Barat","Rp","849 jt","4","3","87 m²","Rp 12.863.636 per m²","tel:+6287785677796","Hubungi"
"Rumah siap huni luas 6x15 90m2 type 2KT di Cluster Mutiara Gading City Bekasi","Cluster Mutiara Gading City Bekasi, Setu, Bekasi, Jawa Barat","Rp","700 jt","2","1","45 m²","Rp 7.777.778 per m²","tel:+6285775559584","Hubungi"
"Cluster asia tropis harapan indah","Harapan Indah, Bekasi, Jawa Barat","Rp","4,3 M","5","5","300 m²","Rp 14.333.333 per m²","tel:+6281298555758","Hubungi"
"Rumah Minimalis Siap Huni Dlm Perum Besar Di Kodau Jatimekar","Kodau, Pondokgede, Bekasi, Jawa Barat","Rp","750 jt","3","1","50 m²","Rp 10.273.973 per m²","tel:+6281282940124","Hubungi"
"Maple Summarecon Bekasi","Summarecon Bekasi, Bekasi Utara, Bekasi, Jawa Barat","Rp","2,4 M","3","3","156 m²","Rp 16.666.667 per m²","tel:+6281212110711","Hubungi"
"Amna residence","Jl lame blok mesjid jatikarya, Jatisampurna, Bekasi, Jawa Barat","Rp","500 jt","2","1","37 m²","Rp 10.000.000 per m²","tel:+6285813497489","Hubungi"
"sagarajaya","Tarumajaya, Bekasi, Jawa Barat","Rp","450 jt","2","1","38 m²","Rp 7.500.000 per m²","",""
"Jatisari Jatiasih","Jalan Sirojul Munir, Jati Sari, Bekasi, Jawa Barat","Rp","595 jt","2","1","60 m²","Rp 6.467.391 per m²","",""
"Jatimakmur","Jalan jatimakmur, Jati Makmur, Bekasi, Jawa Barat","Rp","1,65 M","4","4","130 m²","Rp 15.420.561 per m²","",""
"Dijual Rumah Baru, Mewah & Murah 3 Kamar dekat ke jalan raya di Kodau Jatimekar","Jalan Kodau, Jatiasih, Bekasi, Jawa Barat","Rp","1,15 M","3","2","98 m²","Rp 10.952.381 per m²","",""
"Dijual rumah baru di Arana HI2","Tarumajaya, Bekasi, Jawa Barat","Rp","2,2 M","4","3","124 m²","Rp 15.277.778 per m²","",""
"Jatikramat, Jatiwarna Bekasi","Jatikramat, Jatiwarna Bekasi, Jati Warna, Bekasi, Jawa Barat","Rp","650 jt","2","1","36 m²","Rp 9.027.778 per m²","",""
"Kota Harapan Indah","Jl Bekasi Raya, Bekasi, Bekasi, Jawa Barat","Rp","5 M","5","4","400 m²","Rp 18.115.942 per m²","",""
"dijual cepat BU rumah siap huni di perumahan bina satria bekasi","perumahan bina satria bekasi, Babelan, Bekasi, Jawa Barat","Rp","550 jt","3","2","60 m²","Rp 9.166.667 per m²","",""
"Dijual Rumah Full Furnish di Cluster Arana Kondisi Sangat Bagus dan Siap Huni","Bekasi Barat, Bekasi, Jawa Barat","Rp","3 M","5","4","130 m²","Rp 20.833.333 per m²","",""
"Dijual Rumah Cluster Vasana Siap Huni Lokasi Pas Depan Taman","Bekasi Barat, Bekasi, Jawa Barat","Rp","1,5 M","3","3","100 m²","Rp 13.888.889 per m²","",""
"Dijual cepat rumah termurah di cluster harmoni harapan indah Bekasi","Harapan Indah, Bekasi, Jawa Barat","Rp","1,09 M","4","3","105 m²","Rp 10.380.952 per m²","",""
"Dijual Rumah Bagus Siap Huni di Galaxy bekasi Jawa barat","green viewgalaxy bekasi, Galaxy, Bekasi, Jawa Barat","Rp","1,85 M","3","3","136 m²","Rp 17.619.048 per m²","",""
"Dijual Cepar Rumah Murah Di Green Ara Bekasi Jawa Barat","Green Ara bekasi, Tarumajaya, Bekasi, Jawa Barat","Rp","875 jt","2","1","55 m²","Rp 8.578.431 per m²","",""
"Dijual Rumah Murah Siap Huni di Cluster Taman Sari Harapan Indah Bekasi","Bekasi Barat, Bekasi, Jawa Barat","Rp","1,1 M","3","2","263 m²","Rp 8.730.159 per m²","",""
"Dijual Murah Rumah 2 lantai di Galaxy Bekasi Jawa Barat","Galaxy Bekasi Jawa Barat, Galaxy, Bekasi, Jawa Barat","Rp","2,9 M","5","4","255 m²","Rp 16.860.465 per m²","",""
"Dijual Cepat Rumah tinggal di Cluster Ifolia Harapan Indah Bekasi .","Cluster Ifolia Harapan Indah Bekasi ., Harapan Indah, Bekasi, Jawa Barat","Rp","1,275 M","3","2","100 m²","Rp 8.854.167 per m²","",""
"Dijual Rumah Cluster Vasana Siap Huni Lokasi Pas Depan Taman","Bekasi Barat, Bekasi, Jawa Barat","Rp","1,5 M","3","3","100 m²","Rp 13.888.889 per m²","",""
"Dijual / Disewakan cepat Rumah di Cluster Liverpool Mutiara Gading City, Bekasi","Cluster Liverpool Mutiara Gading City, Bekasi, Tarumajaya, Bekasi, Jawa Barat","Rp","650 jt","2","1","54 m²","Rp 9.027.778 per m²","",""
"DIJUAL RUMAH DI JATIWARNA PERBATASAN BEKASI ! DAN JAKARTA TIMUR","DI JATIWARNA PERBATASAN BEKASI, Jati Warna, Bekasi, Jawa Barat","Rp","900 jt","1","1","38 m²","Rp 11.538.462 per m²","",""
"Dijual Cepar Rumah Murah di cluster vasana Harapan indah Bekasi Jawa Barat","cluster vasana Harapan indah Bekasi, Harapan Indah, Bekasi, Jawa Barat","Rp","1,4 M","3","3","110 m²","Rp 23.333.333 per m²","",""
"Rumah Bekasi 2 Lantai Eksklusif Free Biaya Dekat Pintu Tol Jatiasih","Jalan Wibawa Mukti II, Jatiasih, Kota Bekasi, Jatiasih, Bekasi, Jawa Barat","Rp","706 jt","3","2","70 m²","Rp 11.031.250 per m²","",""
"PONDOK GEDE","Jln H Toha Jatimakmur. Pondok gede kota bekasi, Pondokgede, Bekasi, Jawa Barat","Rp","1,6 M","3","3","130 m²","Rp 14.953.271 per m²","",""
"Emerald Terrace Bekasi Tanpa DP","Jl.wibawa mukti, Bekasi Selatan, Bekasi, Jawa Barat","Rp","995,812236 jt","2","2","48 m²","Rp 16.596.871 per m²","",""
"Prima Harapan Regency","Jl. Raya Perjuangan, Harapan Baru, Harapan Baru, Bekasi, Jawa Barat","Rp","900 jt","3","2","50 m²","Rp 12.500.000 per m²","",""
"Cibubur, Bekasi, Jawa Barat","Cibubur, Bekasi, Jawa Barat, Cibubur, Bekasi, Jawa Barat","Rp","550 jt","2","1","40 m²","Rp 10.000.000 per m²","",""
"Rumah mewah dua lantai strategis dekat tol bekasi timur","swadaya1, Bekasi Timur, Bekasi, Jawa Barat","Rp","650 jt","2","2","65 m²","Rp 8.783.784 per m²","",""
"Perumahan Duta Harapan","Jl. Perjuangan, Boulevard Barat, Bekasi, Bekasi, Bekasi, Jawa Barat","Rp","1,1 M","3","2","144 m²","Rp 7.638.889 per m²","",""
"Dijual rumah Murah  di lavesh harapan indah Bekasi Jawa barat","lavesh harapan indah Bekasi Jawa barat, Harapan Indah, Bekasi, Jawa Barat","Rp","1,2 M","2","2","56 m²","Rp 14.285.714 per m²","",""
"Jatiwarna","Bulog, Jati Warna, Bekasi, Jawa Barat","Rp","3,8 M","5","3","200 m²","Rp 14.074.074 per m²","",""
"Citra gran","Jln alternatif cibubur, Jatisampurna, Bekasi, Jawa Barat","Rp","1,75 M","4","3","135 m²","Rp 16.666.667 per m²","",""
"Jatiasih","Graha indah jatiasih, Jatiasih, Bekasi, Jawa Barat","Rp","1,6 M","2","3","300 m²","Rp 8.556.150 per m²","",""
"Kota Harapan Indah","Jl Bekasi Raya, Bekasi, Bekasi, Jawa Barat","Rp","1,35 M","3","2","120 m²","Rp 13.775.510 per m²","",""
"Harapan Indah",". Jl Bekasi Raya, Medan Satria, Bekasi, Medan Satria, Bekasi, Jawa Barat","Rp","689 jt","3","2","75 m²","Rp 8.948.052 per m²","",""
"Trevista Bekasi",". Jl. Perjuangan Km. 7 No. 99, Bekasi Utara, Bekasi, Jawa Barat","Rp","902,535 jt","3","1","56 m²","Rp 9.917.967 per m²","",""
"Kota Harapan Indah Cluster Aralia","Jl. Bekasi Raya, Medan Satria, Bekasi, Medan Satria, Bekasi, Jawa Barat","Rp","1,275 M","3","1","112 m²","Rp 11.383.929 per m²","",""
"DIJUAL HUNIAN KOKOH PONDOK UGU PERMAI (H0975)","pondok ungu permai, Bekasi Utara, Bekasi, Jawa Barat","Rp","500 jt","2","1","60 m²","Rp 8.333.333 per m²","",""
"Prima Harapan Regency","Jl. Raya Perjuangan, Harapan Baru, Harapan Baru, Bekasi, Jawa Barat","Rp","900 jt","3","2","100 m²","Rp 11.538.462 per m²","",""
"Rumah rapih pondok ungu permai (H0410)","pondok ungu permai, Bekasi Utara, Bekasi, Jawa Barat","Rp","450 jt","2","1","60 m²","Rp 7.500.000 per m²","",""
"Dijual cepat rumah bagus di Harapan Indah Cluster Aralia Bekasi","Harapan Indah Cluster Aralia, Harapan Indah, Bekasi, Jawa Barat","Rp","1,2 M","2","1","62 m²","Rp 9.523.810 per m²","",""
"Jatiasih","Komsen, Jatiasih, Bekasi, Jawa Barat","Rp","679 jt","2","1","45 m²","Rp 10.777.778 per m²","",""
"HUNIAN MODEREN VILLA GADING HARAPAN BEKASI (H0413)","villa gading harapan 3, Babelan, Bekasi, Jawa Barat","Rp","350 jt","2","1","50 m²","Rp 4.861.111 per m²","",""
"Z Living Grand Wisata Rumah DP 0%","Jl. Kw. Grand Wisata, RT.006/RW.016, Mustika Jaya, Grand Wisata, Bekasi, Jawa Barat","Rp","2,6 M","4","3","125 m²","Rp 16.883.117 per m²","",""
"Z Living Grand Wisata Rumah DP 0%","Jl. Kw. Grand Wisata, RT.006/RW.016, Mustika Jaya, Grand Wisata, Bekasi, Jawa Barat","Rp","2,6 M","4","3","125 m²","Rp 16.883.117 per m²","",""
"Z Living Grand Wisata Cicilan 5 Jt-an/Bulan","Jl. Kw. Grand Wisata, RT.006/RW.016, Mustika Jaya, Grand Wisata, Bekasi, Jawa Barat","Rp","1,6 M","3","2","88 m²","","",""
"Summarecon Bekasi Mulberry Residence","RT.014/RW.009, Harapan Baru, Bekasi Utara, Summarecon Bekasi, Bekasi, Jawa Barat","Rp","1,833 M","4","3","117 m²","Rp 17.625.000 per m²","",""
"Emerald Terrace Jatiasih Rumah DP 0%","Jl. Wibawa Mukti II, RT.001/RW.006, Jatiasih, Bekasi, Jawa Barat","Rp","940 jt","2","2","51 m²","Rp 15.666.667 per m²","",""
"Morizen Summarecon Bekasi Rumah Konsep Jepang","Jl. Bulevar Barat, Summarecon Bekasi, Summarecon Bekasi, Bekasi, Jawa Barat","Rp","2,8 M","4","4","151 m²","Rp 21.538.462 per m²","",""
"Pondok Ungu Permai","Pondok Ungu, Kaliabang, Bekasi, Jawa Barat","Rp","580 jt","2","1","50 m²","Rp 8.055.556 per m²","",""
"DIJUAL RUMAH PONDOK UNGU SEKTOR V BEKASI (H0952)","PUP SEKTOR 5, Babelan, Bekasi, Jawa Barat","Rp","800 jt","4","1","100 m²","Rp 6.153.846 per m²","",""
"Dijual rumah siap huni  di cluster ifolia  Harapan Indah Bekasi","Harapan Indah, Harapan Indah, Bekasi, Jawa Barat","Rp","1,4 M","3","2","100 m²","Rp 9.722.222 per m²","",""
"Summarecon Bekasi","Cluster Magnolia, Summarecon Bekasi, Bekasi, Jawa Barat","Rp","2,65 M","3","2","186 m²","Rp 18.402.778 per m²","",""
"Summarecon Bekasi","Cluster Magnolia, Summarecon Bekasi, Bekasi, Jawa Barat","Rp","2,65 M","3","3","148 m²","Rp 16.358.025 per m²","",""
"Dijual Rumah Murah Cibitung Bekasi","Jalan Raya Tambelang, Cibitung, Bekasi, Jawa Barat","Rp","150 jt","2","1","30 m²","Rp 2.500.000 per m²","",""
"Dijual Rumah Murah Tambun Dekat Pintu Tol Gabus","Jalan Raya Tambelang, Tambelang, Bekasi, Jawa Barat","Rp","180 jt","2","1","36 m²","Rp 3.000.000 per m²","",""
"Rumah Murah 2 Lantai Di Bekasi","Jl. Mandor Demong, Mustika Sari, Mustika Jaya, Mustikajaya, Bekasi, Jawa Barat","Rp","824 jt","3","2","53 m²","Rp 13.733.333 per m²","",""
"Dijual Rumah Syariah Bekasi","Jalan Barin Raya, Mustikajaya, Bekasi, Jawa Barat","Rp","999 jt","3","2","60 m²","Rp 13.875.000 per m²","",""
"Kota Harapan Indah Cluster Harmoni","Jl. Bekasi Raya, Medan Satria, Bekasi, Medan Satria, Bekasi, Jawa Barat","Rp","1,375 M","4","3","100 m²","Rp 13.095.238 per m²","",""
