"nav-link","listing-location","currency","price","bed","bath","listing-floorarea","listing-floorarea 2","hidden-sm href 2","hidden-sm 2"
"CitraGrand Cibubur CBD - New Project","Jl. CitraGrand Cibubur CBD, Jatisampurna, Bekasi, Jawa Barat","Rp","1,21 M","3","2","60 m²","","",""
"Palem Lestari","Jl. Raya Mess Al, Jatisampurna, Bekasi, Jawa Barat","Rp","1,187 M","3","3","77 m²","","",""
"Bekasi kota","Jatiasih, Bekasi Selatan, Bekasi, Jawa Barat","Rp","900 jt","2","2","48 m²","Rp 15.000.000 per m²","",""
"Full Bata Merah, Dp10jt (All in) Cicilan 2jtan, Free Semua Biaya, Bebas Banjir, Dekat Gerbang Tol","081289299785,10 Menit dari Gerbang Tol, Jatiasih, Bekasi, Jawa Barat","","555","2","1","47 m²","Rp 9 per m²","",""
"Jatiasih","Wibawa Mukti, Jatiasih, Bekasi, Jawa Barat","Rp","600 jt","2","2","60 m²","Rp 10.909.091 per m²","",""
"Pondok gede","Jatimakmur, Bekasi, Bekasi, Jawa Barat","Rp","845 jt","3","2","75 m²","Rp 13.000.000 per m²","",""
"Cluster Marocco Grand Kota Bintang","Jalan. KH Noer Ali, Kalimalang, Bekasi Barat, Bekasi, Jawa Barat","Rp","1,3986 M","3","2","75 m²","Rp 15.540.000 per m²","",""
"PERDANA Summarecon Crown Gading SCG rumah 2lt lebar 5 harga 1 Milyar An","Harapan Indah, Bekasi, Jawa Barat","Rp","952 jt","2","2","70 m²","Rp 17.309.091 per m²","",""
"Cluster Adara Harapan Indah Bekasi Dijual Rumah","Harapan Indah, Bekasi, Jawa Barat","Rp","1,6 M","2","2","80 m²","Rp 12.698.413 per m²","",""
"Rumah baru dijual dalam cluster 4 unit 2 lantai lagi di jati luhur jati asih","Bekasi Selatan, Bekasi, Jawa Barat","Rp","760 jt","3","2","70 m²","Rp 11.692.308 per m²","",""
"Dp 10Jt, Cicilan start 4jt, Cluster 2 Lantai Termurah dengan lokasi yg Strategis Tidak Banjir","081289299785, 10 Menit dari Gerbang Tol, Jatiasih, Bekasi, Jawa Barat","","690","3","2","72 m²","Rp 9 per m²","",""
"Rumah Cantik 2 lantai Grand Wisata","Grand Wisata, Grand Wisata, Bekasi, Jawa Barat","Rp","1,4 M","4","3","140 m²","Rp 13.333.333 per m²","",""
"Amna residen cibubur jatikarya","Amna residen cibubur jatikarya Bekasi jawabarat, Cibubur, Bekasi, Jawa Barat","Rp","400 jt","2","1","37 m²","Rp 6.666.667 per m²","",""
"Harapan Indah",". Jl Bekasi Raya, Medan Satria, Bekasi, Medan Satria, Bekasi, Jawa Barat","Rp","779 jt","3","2","63 m²","Rp 14.698.113 per m²","",""
"Rumah milenial smarthome bekasi","Jalan gondang mustika bekasi, Rawalumbu, Bekasi, Jawa Barat","Rp","689,532255 jt","2","2","52 m²","Rp 13.790.645 per m²","",""
"Swadaya Townhouse","Jl Bojongkulur, Bojong Kulur, Bekasi, Jatiasih, Bekasi, Jawa Barat","Rp","435 jt","2","1","40 m²","Rp 7.250.000 per m²","",""
"Cibubur","Harvest City, Cibubur, Bekasi, Jawa Barat","Rp","498 jt","2","1","30 m²","Rp 8.300.000 per m²","",""
"Jual Rumah Strategis Dekat Gerbang Tol Tambun Harga Nego Bisa KPR Biaya All in Bebas Banjir","Tambun Selatan, Bekasi, Jawa Barat","Rp","680 jt","2","1","36 m²","Rp 9.444.444 per m²","",""
"Jual Rumah Siap Huni Di Premier Savanna Vida Dekat Jatiasih Harga All In Nego Siap KPR","Premier Savanna Vida, Jatiasih, Bekasi, Jawa Barat","Rp","780 jt","2","1","53 m²","Rp 9.285.714 per m²","",""
"10 Juta Punya Rumah Full Bata Merah","Jatiasih, Jatiasih, Bekasi, Jawa Barat","","500","2","1","41 m²","Rp 9 per m²","",""
"Beli Rumah Hanya 5Jt di Jatiasih","Jatiasih, Jatiasih, Bekasi, Jawa Barat","","725","2","2","56 m²","Rp 11 per m²","",""
"RUMAH READY STOCK 5 JT SIAP HUNI SHM IMB READY","AKSES LEBAR FREE CANOPY PAGAR DI JATIASIH, Jatiasih, Bekasi, Jawa Barat","","700","2","2","53 m²","Rp 11 per m²","",""
"Jual Cepat Rumah Luas Strategis Harga All in di Royal Park Residence Siap KPR Bebas Banjir","Bekasi Timur, Bekasi, Jawa Barat","Rp","1,2 M","3","2","90 m²","Rp 7.272.727 per m²","",""
"Jual Cepat Rumah Minimalis Modern Siap KPR di Citragrand Cibubur Harga All In","Jaka Sampurna, Bekasi, Jawa Barat","Rp","1,62 M","3","2","116 m²","Rp 22.500.000 per m²","",""
"Jual Cepat Rumah Asri 3 Lantai Siap KPR di Jati Sampurna Bekasi Harga All In Biaya Nego","Jaka Sampurna, Bekasi, Jawa Barat","Rp","2,22 M","4","3","200 m²","Rp 18.500.000 per m²","",""
"Jual Rumah Siap Huni Strategis Di Vida Bekasi Dekat Jatiasih Harga All In Siap KPR","Vida Bekasi Cluster Frambosa, Jatiasih, Bekasi, Jawa Barat","Rp","990 jt","3","3","164 m²","Rp 9.166.667 per m²","",""
"Jual Rumah Strategis Di Srimaya Residence Harga All In Siap KPR DP Ringan","Srimaya Residence, Bantargebang, Bekasi, Jawa Barat","Rp","499 jt","2","1","30 m²","Rp 8.316.667 per m²","",""
"Jual Rumah Seken Strategis Dekat Bantar Gebang Bekasi Harga Nego Biaya All In Siap KPR","Vida Bumipala Taman Durian, Bantargebang, Bekasi, Jawa Barat","Rp","780 jt","2","2","60 m²","Rp 8.666.667 per m²","",""
"Dijual Rumah Minimalis Siap Huni di Metland Cileungsi Harga All In Bisa Nego Siap KPR","Metland Cileungsi, Setu, Bekasi, Jawa Barat","Rp","630 jt","2","1","70 m²","Rp 7.500.000 per m²","",""
"2 Jt All In, Free Biaya-Biaya di Mustika Jaya","Mustikajaya, Bekasi Timur, Bekasi, Jawa Barat","Rp","455,0003 jt","2","1","41 m²","Rp 6.500.004 per m²","",""
"Jual Cepat Rumah Strategis Dekat Tol Bekasi Siap Huni Harga All In Siap KPR","Metland Menteng Cluster Savana, Medan Satria, Bekasi, Jawa Barat","Rp","2,6325 M","3","4","110 m²","Rp 21.937.500 per m²","",""
"Griya Harapan Permai","Kel. Harapan Baru, Harapan Indah, Bekasi, Jawa Barat","Rp","500 jt","2","1","70 m²","Rp 5.102.041 per m²","",""
"Jual Cepat Rumah Strategis di Cluster Pagar Hijau Jatiasih Harga All In Bisa Nego Siap KPR","Jatisari, Jatiasih, Kota Bekasi, Jatiasih, Bekasi, Jawa Barat","Rp","810 jt","2","1","45 m²","Rp 6.923.077 per m²","",""
"Jual Rumah Siap Huni Strategis Dekat Bekasi Harga All In Bisa Nego Siap KPR","Limus Pratama Regency, Bantargebang, Bekasi, Jawa Barat","Rp","570 jt","2","1","60 m²","Rp 7.916.667 per m²","",""
"Jual Rumah Luas Strategis di Royal Park Residence Bebas Banjir Harga All In Siap KPR","Royal Park Residence Cluster Champions, Jatiasih, Bekasi, Jawa Barat","Rp","1,2 M","3","2","90 m²","Rp 7.272.727 per m²","",""
"Kirana Mas",". Jl. Ciangsana, Bojong Kulur, Jatiasih, Bekasi, Jawa Barat","","750","3","2","60 m²","Rp 10 per m²","",""
"Rumah murah dekat stasiun kranji bekasi siap huni (H0595)","kalibaru, Bekasi Barat, Bekasi, Jawa Barat","Rp","750 jt","3","2","90 m²","Rp 5.514.706 per m²","",""
"5 Jt Langsung AKAD, di Cluster 2 Lantai Eksklusif","Jatiraden, Jatisampurna, Jatiasih, Bekasi, Jawa Barat","Rp","769,0003 jt","3","2","60 m²","Rp 10.680.560 per m²","",""
"DP 5%, Free Biaya-Biaya di Cluster 2 Lantai Jatiluhur","Jatiluhur, jatiasih, Jatiasih, Bekasi, Jawa Barat","","574","2","2","50 m²","Rp 12 per m²","",""
"DP 20 Jt an, Free Biaya-biaya di Cluster Milenial Jatiluhur","Jatiluhur, Jatiasih, Bekasi, Jawa Barat","","465","2","1","30 m²","Rp 8 per m²","",""
"Miliki hunian taman harapan baru bekasi kota (H0365)","taman harapan baru, Medan Satria, Bekasi, Jawa Barat","Rp","650 jt","2","1","50 m²","Rp 9.848.485 per m²","",""
"Jual Rumah Cepat Bebas Banjir Dekat Jatiasih Harga All In Nego Bisa KPR","Jatiasih, Bekasi, Jawa Barat","Rp","570 jt","2","1","60 m²","Rp 7.916.667 per m²","",""
"Jual Cepat Rumah Strategis Dekat Tol Bekasi Harga Nego Biaya All In Siap KPR","Metland Menteng Cluster Savana, Harapan Indah, Bekasi, Jawa Barat","Rp","2,6325 M","3","4","110 m²","Rp 21.937.500 per m²","",""
"Jual Rumah Unit Pojokan Siap Huni di Cluster Batara Residence Harga All In Siap KPR","Cluster Batara Residence, Jatiasih, Bekasi, Jawa Barat","Rp","680 jt","2","1","36 m²","Rp 9.444.444 per m²","",""
"Jual Rumah Siap Huni Di Premier Savanna Vida Dekat Mustika Jaya Harga All In Nego Siap KPR","Premier Savanna Vida, Mustikajaya, Bekasi, Jawa Barat","Rp","780 jt","2","1","53 m²","Rp 9.285.714 per m²","",""
"Dijual Rumah Asri Bebas Banjir di Bukit Golf Riverside Harga Nego Biaya All In Siap KPR","Bukit Golf Riverside, Jatisampurna, Bekasi, Jawa Barat","Rp","2,55 M","3","3","160 m²","Rp 15.454.545 per m²","",""
"Jual Rumah Siap Huni Di Srimaya Residence Bekasi Harga All In Siap KPR DP Ringan","Srimaya Residence, Setu, Bekasi, Jawa Barat","Rp","499 jt","2","1","30 m²","Rp 8.316.667 per m²","",""
"Kodau jatimekar","Jl flamboyan III no . 69, Bekasi Selatan, Bekasi, Jawa Barat","Rp","1,15 jt","3","3","83 m²","Rp 14.375 per m²","",""
"Rumah 2 Lantai Siap Huni Dekat Ke Jalan Raya Bogor, Juanda, dan Margonda Depok","Jalan Haji Apat Sukmajaya Depok, Bekasi Selatan, Bekasi, Jawa Barat","Rp","1,2 M","3","2","77 m²","Rp 20.000.000 per m²","",""
"Ready Stok, DP 5%, Free Biaya-Biaya di Cluster baru Jatiluhur","Jatiluhur, jatiasih, Jatiasih, Bekasi, Jawa Barat","","695","2","2","58 m²","Rp 11 per m²","",""
"Kenanga residence","Jl. Kenanga - Harjamukti jati sampurna Bekasi, Bekasi Timur, Bekasi, Jawa Barat","Rp","690 jt","3","2","60 m²","Rp 9.452.055 per m²","",""
"Tropical Townhouse Jatiwaringin","Jl. Antara Dalam, RT.002/RW.019, Jatimakmur, Jati Makmur, Bekasi, Jawa Barat","Rp","900 jt","2","2","65 m²","Rp 16.363.636 per m²","",""
"Jual Rumah 2 Lantai Siap Huni Strategis Dekat Jatiasih Harga All In Bisa Nego Siap KPR","Lavender Residence, Jatiasih, Bekasi, Jawa Barat","Rp","1,08 M","2","2","90 m²","Rp 10.285.714 per m²","",""
"Jual Cepat Rumah Siap Huni Dekat Bantargebang Bekasi Bebas Banjir Harga All In Siap KPR","Bantargebang, Bekasi, Jawa Barat","Rp","799 jt","2","1","70 m²","Rp 8.237.113 per m²","",""
"Jual Rumah di Pondok Melati Bekasi Bebas Banjir Siap Huni Harga All In Siap KPR","Cluster Puri Zalfari, Pondokmelati, Bekasi, Jawa Barat","Rp","799 jt","2","1","70 m²","Rp 8.237.113 per m²","",""
"Rumah Siap Huni di komplek Pondok Pekayon Indah Kota Bekasi, Dijual Cepat","Bekasi, Bekasi, Jawa Barat","Rp","2,5 M","4","5","250 m²","Rp 16.666.667 per m²","",""
"De Azra Residence","Jalan bina asih 2, Jatiasih, Bekasi, Jawa Barat","Rp","1,7 M","3","3","138 m²","Rp 21.250.000 per m²","",""
"Jual Rumah Siap Huni Di Premier Savanna Vida Dekat Jatiasih Bekasi Harga All In Siap KPR","Premier Savanna Vida, Jatiasih, Bekasi, Jawa Barat","Rp","1,02 M","3","2","69 m²","Rp 11.333.333 per m²","",""
"Summarecon Crown Gading Bekasi","Cluster Regina, Bekasi, Bekasi, Jawa Barat","Rp","2,11 M","5","4","120 m²","Rp 19.537.037 per m²","",""
"Dijual Rumah Minimalis Siap Huni di Royal Park Residence Harga All In Siap KPR","Mustikajaya, Bekasi, Jawa Barat","Rp","1,2 M","3","2","90 m²","Rp 7.272.727 per m²","",""
"Jual Rumah Siap Huni Cluster Puri Zalfari Dekat Jati Warna Bekasi Harga All In Nego Bisa KPR","Jati Warna, Bekasi, Jawa Barat","Rp","799 jt","2","1","70 m²","Rp 8.237.113 per m²","",""
"Dijual Rumah Bebas Banjir Siap Huni Dekat Jati Warna Bekasi Harga All In Bisa Nego Siap KPR","Jati Warna, Bekasi, Jawa Barat","Rp","810 jt","2","1","45 m²","Rp 6.923.077 per m²","",""
"Rumah Minimalis Strategis Dekat Bantar Gebang Bekasi Siap Huni Harga All In Siap KPR DP Ringan","Limus Pratama Regency, Bantargebang, Bekasi, Jawa Barat","Rp","599 jt","2","2","105 m²","Rp 5.704.762 per m²","",""
"Jual Rumah Siap Huni Di Premier Savanna Vida Dekat Galaxy Bekasi Harga All In Siap KPR","Premier Savanna Vida, Galaxy, Bekasi, Jawa Barat","Rp","1,02 M","3","2","69 m²","Rp 11.333.333 per m²","",""
"Jual Rumah Siap Huni Strategis Dekat Harapan Indah Bekasi Harga Nego Biaya All In Siap KPR","Perumahan Telaga Mas, Harapan Indah, Bekasi, Jawa Barat","Rp","950 jt","3","2","87 m²","Rp 14.393.939 per m²","",""
"Jual Rumah Strategis Di Vida Bumipala Taman Durian Bebas Banjir Harga All In Siap KPR","Vida Bumipala Taman Durian, Mustikajaya, Bekasi, Jawa Barat","Rp","780 jt","2","2","60 m²","Rp 8.666.667 per m²","",""
"Jual Rumah Siap Huni Strategis Di Vida Bekasi Harga Nego Biaya All In Siap KPR","Vida Bekasi Cluster Frambosa, Mustikajaya, Bekasi, Jawa Barat","Rp","990 jt","3","3","164 m²","Rp 9.166.667 per m²","",""
"Rumah murah cantik minimalis cluster asri 2 lantai dekat ke pintu tol Cibubur","Jln kranggan permai Cibubur Jatisampurna Bekasi, Cibubur, Bekasi, Jawa Barat","Rp","675 jt","3","2","60 m²","Rp 11.637.931 per m²","",""
"Summarecon Crown Gading","Cluster Jasmia, Bekasi, Bekasi, Jawa Barat","Rp","2,713 M","4","4","149 m²","Rp 20.096.296 per m²","",""
"Jual Rumah Minimalis 2 Lantai Siap Huni di Lavender Residence Harga All In Bisa Nego Siap KPR","Jatisampurna, Bekasi, Jawa Barat","Rp","1,08 M","2","2","90 m²","Rp 10.285.714 per m²","",""
"Jual Cepat Rumah Strategis di Cluster Pagar Hijau Dekat Galaxy Bekasi Harga All InNego Siap KPR","Galaxy, Bekasi, Jawa Barat","Rp","810 jt","2","1","45 m²","Rp 6.923.077 per m²","",""
"Jual Rumah Siap Huni Strategis Dekat Bekasi Barat Harga Nego Biaya All In Siap KPR","Perumahan Telaga Mas, Bekasi Barat, Bekasi, Jawa Barat","Rp","950 jt","3","2","87 m²","Rp 14.393.939 per m²","",""
"Jual Rumah Seken Terawat Siap Huni Di Vida Bekasi Harga Nego Biaya All In Siap KPR","Vida Bekasi Cluster Frambosa, Bantargebang, Bekasi, Jawa Barat","Rp","990 jt","3","3","164 m²","Rp 9.166.667 per m²","",""
"Jual Cepat Rumah Unit Pojokan Siap Huni Harga All In Siap KPR di Cluster Batara Residence","Cluster Batara Residence, Mustikajaya, Bekasi, Jawa Barat","Rp","680 jt","2","1","36 m²","Rp 9.444.444 per m²","",""
"Perumahan firdaus residence 3","Cikarageman, Cikarang Selatan, Bekasi, Jawa Barat","Rp","340,83 jt","2","1","32 m²","Rp 5.164.091 per m²","",""
"Dijual Cepat Rumah Summarecon Bekasi","Bekasi Barat, Bekasi, Jawa Barat","Rp","2,2 M","3","3","132 m²","Rp 17.460.317 per m²","",""
"Jual Rumah Cepat Siap Huni di Metland Cileungsi Dekat Bantar Gebang Harga All In Siap KPR","Bantargebang, Bekasi, Jawa Barat","Rp","630 jt","2","1","70 m²","Rp 7.500.000 per m²","",""
"Dijual Rumah Cluster Puri Zalfari di Jatiasih Bekasi Siap Huni Harga All In Siap KPR","Cluster Puri Zalfari, Jatiasih, Bekasi, Jawa Barat","Rp","799 jt","2","1","70 m²","Rp 8.237.113 per m²","",""
"Jual Rumah Siap Huni Strategis Dekat Jatiasih Harga Nego Biaya All In Siap KPR","Perumahan Grand Mutiara 2, Jatiasih, Bekasi, Jawa Barat","Rp","1,56 M","3","3","240 m²","Rp 12.580.645 per m²","",""
"Mustika Jaya , Bekasi Kota , jl. Raya KLP dua","Jalan Raya KLP dua, Bekasi Timur, Bekasi, Jawa Barat","Rp","599 jt","2","1","48 m²","Rp 6.655.556 per m²","",""
"Rumah Cluster Arcade Mustika Jaya Bekasi Kota dkt RS Mustika Medika","Jalan KLP dua, Narogong, Bekasi, Jawa Barat","Rp","565 jt","3","2","62 m²","Rp 5.539.216 per m²","",""
"Rumah baru siap huni termurah dalam cluster dekat toll jatiasih","Jatiasih, Jatiasih, Bekasi, Jawa Barat","Rp","580 jt","2","1","36 m²","Rp 8.285.714 per m²","",""
"Rumah baru 2 lantai di lokasi strategis jatiasih","Jatiasih, Jatiasih, Bekasi, Jawa Barat","Rp","1,2 M","3","3","130 m²","Rp 13.333.333 per m²","",""
"Rumah baru siap huni cuma 500meter ke pintu toll jorr jatiasih","Jatiasih, Jatiasih, Bekasi, Jawa Barat","Rp","1,2 M","3","3","130 m²","Rp 13.333.333 per m²","",""
"Rumah cantik 2 lantai baru dalam komplek pemda jatiasih","Jatiasih, Jatiasih, Bekasi, Jawa Barat","Rp","1,2 M","3","3","130 m²","Rp 13.333.333 per m²","",""
"Jakarta timur cijantung cipayung cibubur","Jl lindung, Jatisampurna, Bekasi, Jawa Barat","Rp","2,5 M","5","5","160 m²","Rp 22.321.429 per m²","",""
"Sinar asih","Sinar asih, Jatiasih, Bekasi, Jawa Barat","Rp","1,3 M","3","3","112 m²","Rp 21.666.667 per m²","",""
"Rumah Modern 2 lantai selangkah ke Harapan Indah hanya 2 Juta hingga Akad","H. Genang Tanah Tinggi, Tarumajaya, Bekasi, Jawa Barat","Rp","790 jt","3","1","63 m²","Rp 14.363.636 per m²","",""
"Grand camar hijau","Jl Abror jatiraden jatisampurna, Jatisampurna, Bekasi, Jawa Barat","Rp","985 jt","3","3","70 m²","Rp 16.416.667 per m²","",""
"Casturi Rumah Cileungsi","Jl. Setu Cileungsi Pasir Angin, Bekasi Barat, Bekasi, Jawa Barat","Rp","335 jt","2","1","40 m²","Rp 4.785.714 per m²","",""
"Rumah Tanpa DP Hanya Booking 2 Juta Hingga Akad di Bekasi","Jl. Pulo Timaha, Babelan, Bekasi, Jawa Barat","Rp","375 jt","2","1","36 m²","Rp 6.250.000 per m²","",""
"Rumah DP 0% Hanya Booking 2 Juta Hingga Terima Kunci dekat Tarumajaya Bekasi","Jl. Pulo Timaha, Tarumajaya, Bekasi, Jawa Barat","Rp","375 jt","2","1","36 m²","Rp 1.000.000 per m²","",""
"Rumah Modern 2 Lantai untuk Milenial di Mustikajaya Bekasi 15 menit Tol Grand Wisata","Jl. Mustikajaya, Bekasi Timur, Bekasi, Jawa Barat","Rp","799 jt","3","1","53 m²","Rp 13.316.667 per m²","",""
"Rumah 2 lt, mantap tanpa Dp, samping Summarecon crown","Jl H. Genang, tanah tinggi, setia asih,, Tarumajaya, Bekasi, Jawa Barat","Rp","779 jt","3","2","63 m²","Rp 14.698.113 per m²","",""
"Cluster 3 House jatiasih","Jalan Bina asih II, Jatiasih, Bekasi, Jawa Barat","Rp","1,399 M","3","2","105 m²","Rp 12.491.071 per m²","",""
"Dijual Rumah Di Jatiasih, Murah Tanah Luas Siap Huni Strategis Bebas Banjir","Jln Raya Jatiasih, Jatiasih, Bekasi, Jawa Barat","Rp","1,35 M","4","3","133 m²","Rp 7.714.286 per m²","",""
"Rumah 2 lantai Dekat Harapan Indah","J. Genang, Tarumajaya, Bekasi, Jawa Barat","Rp","799 jt","3","1","63 m²","Rp 15.075.472 per m²","",""
"Pesona Setu Indah",". Jl. Setu, Setu, Bekasi, Jawa Barat","Rp","418 jt","2","1","45 m²","Rp 5.805.556 per m²","",""
"Rumah Cluster Full Bata Merah Bebas Banjir","Bebas semua biaya surat surat DP ringan, Mustikajaya, Bekasi, Jawa Barat","Rp","624,5 jt","2","2","51 m²","Rp 8.673.611 per m²","",""
"Cluster syariah","Jalan Karya logam Jatimulya, Bekasi Timur, Bekasi, Jawa Barat","Rp","539 jt","2","1","45 m²","Rp 8.983.333 per m²","",""
"Morizen Summarecon Bekasi Rumah 3 Lantai berkonsep Jepang","Jl Morizen, Summarecon Bekasi, Bekasi, Jawa Barat","Rp","4,30125 M","5","6","216 m²","Rp 26.882.812 per m²","",""
"Seven Residence Bekasi Timur","Jl.Caringin 2, Mustikasari Kota Bekasi, Bekasi Timur, Bekasi, Jawa Barat","Rp","750 jt","3","2","72 m²","Rp 7.500.000 per m²","",""
"Mutiara Gading City","Jl. Kaliabang Tengah, Bekasi, Jawa Barat","Rp","370 jt","3","1","42 m²","Rp 5.285.714 per m²","",""
"Kota Harapan Indah","Jl Bekasi Raya, Bekasi, Bekasi, Jawa Barat","Rp","400 jt","3","1","42 m²","Rp 5.555.556 per m²","",""
"Kota Harapan Indah","Jl Bekasi Raya, Bekasi, Bekasi, Jawa Barat","Rp","400 jt","3","1","42 m²","Rp 5.555.556 per m²","",""
"Harapan Indah",". Jl Bekasi Raya, Medan Satria, Bekasi, Medan Satria, Bekasi, Jawa Barat","Rp","400 jt","3","1","42 m²","Rp 5.555.556 per m²","",""
"Jatisari Luxury Residence - Cluster Premium dan Eklusif untuk Milenial","Bekasi Selatan, Bekasi, Jawa Barat","Rp","795 jt","3","2","62 m²","Rp 13.250.000 per m²","",""
"Kota Serang Baru",". Jl. Raya Cibarusah, Cikarang, Cikarang, Bekasi, Jawa Barat","Rp","446,6828 jt","2","1","40 m²","Rp 7.444.713 per m²","",""
"Bekasi Timur-15 Menit dari Pintu Toll Bekasi Timur","Jl.caringin 2, Bekasi Timur, Bekasi, Jawa Barat","Rp","750 jt","3","2","70 m²","Rp 8.823.529 per m²","",""
"New Exclusive Cluster Release Dilan Residence 3 Setu, Bekasi","Cimuning, Setu, Bekasi Timur, Bekasi, Bekasi, Bekasi, Jawa Barat","","350","2","1","40 m²","Rp 5 per m²","",""
"Dilan Residence 3","Cinyosog, Cimuning, Setu, Bekasi, Jawa Barat, Setu, Bekasi, Jawa Barat","","425","2","1","40 m²","Rp 6 per m²","",""
"Dilan Residence 3. Rumah Eksklusif di Bekasi Timur","Cinyosog, Burangkeng, Setu, Bekasi Timur, Bekasi, Bekasi Timur, Bekasi, Jawa Barat","","425","2","1","40 m²","Rp 6 per m²","",""
"Dilan Residence 3","Bekasi, Bekasi, Bekasi, Jawa Barat","Rp","350 jt","2","1","40 m²","Rp 5.000.000 per m²","",""
"Rumah Minimalis di Green Park Residence Bekasi Bebas Banjir Harga All In Kpr","Pondokmelati, Bekasi, Jawa Barat","Rp","1,75 M","3","2","80 m²","Rp 24.305.556 per m²","",""
"Cluster Palm Summarecon bekasi","Palm, Summarecon Bekasi, Bekasi, Jawa Barat","Rp","68 jt","3","3","108 m²","Rp 571.429 per m²","",""
"Di Jual Rumah Mewah 2 Lantai Lokasi Duta Bumi, Harapan Indah. Bekasi 003","Jl. Duta Bumi Raya No. 2, Harapan Indah, Bekasi, Jawa Barat","Rp","925 jt","3","3","80 m²","Rp 10.277.778 per m²","",""
"Rumah baru 2 lantai murah strategis Deket pintu tol di kodau jati mekar bekasi","Kodau, Jati Waringin, Bekasi, Jawa Barat","Rp","1,15 M","3","2","98 m²","Rp 11.165.049 per m²","",""
"Grand permata residence","Jalan sriamur tambun Utara, Bekasi Utara, Bekasi, Jawa Barat","Rp","168 jt","2","1","29 m²","Rp 2.800.000 per m²","",""
"Dijual rumah Griya Harapan Permai, Harapan indah","HARAPAN INDAH, Harapan Indah, Bekasi, Jawa Barat","Rp","1,7 M","4","3","125 m²","Rp 11.333.333 per m²","",""
"DiJual Rumah dan Ruko Bekas Alfamidi di Pilar Cikarang","Jl Ki Hajar dewantara, Bekasi Utara, Bekasi, Jawa Barat","Rp","8,7 M","3","2","456 m²","Rp 14.500.000 per m²","",""
"Rumah Dijual Di Tambun Selatan Dalam Cluster Full Renovasi","Cluster Taman Raya, Mangun Jaya, Tambun Selatan, Bekasi, Jawa Barat","Rp","400 jt","2","1","45 m²","Rp 6.666.667 per m²","",""
"Rumah 2 Lantai Siap Huni","Jl. Wibawa Mukti 2, Jatiasih, Bekasi, Jatiasih, Bekasi, Jawa Barat","Rp","820 jt","3","2","79 m²","Rp 11.549.296 per m²","",""
"Dijual cepat rumah siap huni posisi  hoek di cluster segara city, tarumajaya, Bekasi","Tarumajaya, Bekasi, Jawa Barat","Rp","1,2 M","3","2","150 m²","Rp 6.818.182 per m²","",""
"Taman Harapan Baru Bekasi","taman harapan baru bekasi, Taman Harapan Baru, Bekasi, Jawa Barat","Rp","1,95 M","5","2","122 m²","Rp 10.955.056 per m²","",""
"Kota Harapan Indah Cluster Aralia","Jl. Bekasi Raya, Medan Satria, Bekasi, Medan Satria, Bekasi, Jawa Barat","Rp","1,05 M","3","2","100 m²","Rp 9.375.000 per m²","",""
"Dijual rumah nyaman Asri di Cluster Arana, Harapan Indah, Bekasi bebas banjir","Harapan Indah, Bekasi, Jawa Barat","Rp","3 M","4","4","147 m²","Rp 15.000.000 per m²","",""
"Di Jual Rumah siap huni dan cantik di Pondok Indah, Bekasi","Pondok Indah Jatisari, Jatiasih, Bekasi, Jati Sari, Bekasi, Jawa Barat","Rp","6,8 M","6","9","1400 m²","Rp 9.714.286 per m²","",""
"Dijual Rumah Srimaya Residence Summarecon Bisa KPR","Bantargebang, Bekasi, Jawa Barat","Rp","499 jt","2","1","30 m²","Rp 8.316.667 per m²","",""
"Dijual Rumah Mall Grand Galaxy Park Jalan Villa Jakasetia Galaxy Tol Jakasampurna  Tol Bekasi Barat","Galaxy, Bekasi, Jawa Barat","Rp","1,55 M","3","3","156 m²","Rp 13.135.593 per m²","",""
"Cluster Pagar Hijau Jatiasih","Jatiasih, Bekasi, Jawa Barat","Rp","810 jt","2","1","45 m²","Rp 6.923.077 per m²","",""
"Harapan Indah",". Jl Bekasi Raya, Medan Satria, Bekasi, Medan Satria, Bekasi, Jawa Barat","Rp","445 jt","2","1","36 m²","Rp 7.416.667 per m²","",""
"Harapan Indah",". Jl Bekasi Raya, Medan Satria, Bekasi, Medan Satria, Bekasi, Jawa Barat","Rp","675 jt","3","2","72 m²","Rp 11.250.000 per m²","",""
"Rumah 2 Lantai Hoek Siap Huni","Jl Kusuma Barat Duren Jaya, Bekasi Timur, Bekasi, Jawa Barat","Rp","1,5 M","5","4","180 m²","Rp 10.000.000 per m²","",""
"Cibubur","Jl. Cileungsi Setu Bekasi, Cibubur Cileungsi Setu, Setu, Bekasi, Jawa Barat","Rp","400 jt","2","1","45 m²","Rp 5.333.333 per m²","",""
"Summarecon Crown Gading","Boulevard, Harapan Indah, Bekasi, Jawa Barat","Rp","952 jt","2","2","50 m²","Rp 17.309.091 per m²","",""
"Jakarta Timur","Babelan, Bekasi, Jawa Barat","Rp","385 jt","2","1","30 m²","Rp 6.416.667 per m²","",""
"Jakarta Utara","Bekasi, Bekasi, Jawa Barat","Rp","3 jt","2","1","38 m²","Rp 50.000 per m²","",""
"Perumahan Islami Terbesar di Bekasi, Grand Al-Ihsan Premiere","Jl. Barin Raya No.130, RT.001/RW.001, Mustikasari, Mustikajaya, Bekasi, Jawa Barat","Rp","847 jt","2","1","41 m²","Rp 11.763.889 per m²","",""
"SIAP HUNI cuma 5 juta punya rumah di JATIASIH","AKSES 2 MOBIL GRATISSSS BIAYA BIAYA 3 kamar tidur, Pondokgede, Bekasi, Jawa Barat","","700","3","2","58 m²","Rp 9 per m²","",""
"Rumah Mewah Murah Di Kranggan Dekat Tol Jati Asih Bekasi","Jalan Raya Kranggan, Jatiasih, Bekasi, Jawa Barat","Rp","1,083 M","3","3","77 m²","Rp 12.892.857 per m²","",""
"Royal Park Residence Cluster Champions","Mustikajaya, Bekasi, Jawa Barat","Rp","1,2 M","3","2","90 m²","Rp 7.272.727 per m²","",""
"De Oasis green residence lokasi di segitiga emas kota Bekasi DP 15, jt All in","Jl. Raya ujung aspal,jatirangon Bekasi, Jatisampurna, Bekasi, Jawa Barat","Rp","950 jt","","","50 m²","Rp 15.573.770 per m²","",""
"De Oasis green residence","Jln raya ujung aspal,jatirangon kota Bekasi, Jaka Sampurna, Bekasi, Jawa Barat","Rp","950 jt","","","50 m²","Rp 15.573.770 per m²","",""
"Jual Rumah 1 lantai dekat Cibubur","Jl. Wibawa Mukti II Gg. Diman RT 04 RW 06, Jati Sari, Bekasi, Jawa Barat","Rp","400 jt","2","1","36 m²","Rp 6.666.667 per m²","",""
"Dijual Rumah di Asera One South hook 2 lantai (sudah renov)","Harapan indah, Harapan Indah, Bekasi, Jawa Barat","Rp","4,25 M","4","4","200 m²","Rp 15.740.741 per m²","",""
"Promo Gratis Biaya2, Gratis Canopy, Legalitas Clean n Clear, KPR Bank BSI","Jatiasih,Pondokgede,Kota Bekasi,Bekasi, Jatiasih, Bekasi, Jawa Barat","","750","2","2","53 m²","Rp 12 per m²","",""
"Rumah MURAH Tanpa  DP di jatiasih","GRATIS BIAYA BIAYA, Jati Bening, Bekasi, Jawa Barat","","675","2","2","53 m²","Rp 14 per m²","",""
"Hunian eksklusif di jatiasih","Jl wibawa mukti 2 jati asih, jati asih, Bantargebang, Bekasi, Jawa Barat","Rp","1,3175 M","3","3","115 m²","Rp 21.958.333 per m²","",""
"Harapan Mulya Bekasi Dijual Rumah","Tarumajaya, Bekasi, Jawa Barat","Rp","835 jt","2","1","52 m²","Rp 6.423.077 per m²","",""
